Model,Source,VideoID,Comment,Likes,PublishedAt,Clean_Text
Redmi Buds 4 Pro,YouTube,hH6Z65f6C30,Oneplus nord buds 3 i  was using and they are amazing,0,2025-08-06T10:26:52Z,oneplus nord buds 3 i was using and they are amazing
Redmi Buds 4 Pro,YouTube,hH6Z65f6C30,"Don't buy nothing.i got two models.two head phone battery drain speedy,case charge draineee speedy",0,2025-08-02T20:58:12Z,don t buy nothing i got two models two head phone battery drain speedy case charge draineee speedy
Redmi Buds 4 Pro,YouTube,hH6Z65f6C30,earfuns THE BEST,0,2025-07-31T21:13:00Z,earfuns the best
Redmi Buds 4 Pro,YouTube,hH6Z65f6C30,I'm using oppo enco buds 2 almost 9 month it's one of the best Earbuds ♥️🔥,0,2025-07-31T16:08:52Z,i m using oppo enco buds 2 almost 9 month it s one of the best earbuds
Redmi Buds 4 Pro,YouTube,hH6Z65f6C30,"Guys, I own CMF Buds Pro and Pro 2. For the first six months, everything was working fine, but after that, the left earphone doesn't charge, and I need to repair Bluetooth again and again to use the left one. I found that the issue is with the app, so I am using Nothing X version 2.4.12, and everything is working fine now. Can anyone report this issue to Nothing?",0,2025-07-27T10:00:58Z,guys i own cmf buds pro and pro 2 for the first six months everything was working fine but after that the left earphone doesn t charge and i need to repair bluetooth again and again to use the left one i found that the issue is with the app so i am using nothing x version 2 4 12 and everything is working fine now can anyone report this issue to nothing
Redmi Buds 4 Pro,YouTube,hH6Z65f6C30,How much for your eyes,0,2025-07-26T04:06:45Z,how much for your eyes
Redmi Buds 4 Pro,YouTube,hH6Z65f6C30,"Shame there is and seems like there never will be a oppo enco buds 3
It seems the nord buds 3 takes its place",0,2025-07-22T16:47:59Z,shame there is and seems like there never will be a oppo enco buds 3 it seems the nord buds 3 takes its place
Redmi Buds 4 Pro,YouTube,hH6Z65f6C30,Realme T310s are better then Nothing,0,2025-07-22T12:58:02Z,realme t310s are better then nothing
Redmi Buds 4 Pro,YouTube,hH6Z65f6C30,These are not the budget tws 😂,0,2025-07-22T11:26:06Z,these are not the budget tws
Redmi Buds 4 Pro,YouTube,hH6Z65f6C30,why not SKULLCANDY RAIL ANC,0,2025-07-21T15:15:09Z,why not skullcandy rail anc
Redmi Buds 4 Pro,YouTube,hH6Z65f6C30,"Hey dude, just wanted to say I love your enthusiasm in your videos! I'll definitely be watching your videos again 😎👍",3,2025-07-21T08:06:51Z,hey dude just wanted to say i love your enthusiasm in your videos i ll definitely be watching your videos again
Redmi Buds 4 Pro,YouTube,hH6Z65f6C30,Bro cover IEM earphones 🙌,0,2025-07-15T13:39:27Z,bro cover iem earphones
Redmi Buds 4 Pro,YouTube,hH6Z65f6C30,Ashley look at me 👀,0,2025-07-15T12:26:38Z,ashley look at me
Redmi Buds 4 Pro,YouTube,hH6Z65f6C30,Realme t310 are available for 1699 right now ... If some one want to buy.....I ordered 😁,6,2025-07-12T11:50:41Z,realme t310 are available for 1699 right now if some one want to buy i ordered
Redmi Buds 4 Pro,YouTube,hH6Z65f6C30,For movie and calling realme t3100 or oneplus nord 3,0,2025-07-12T05:37:41Z,for movie and calling realme t3100 or oneplus nord 3
Redmi Buds 4 Pro,YouTube,hH6Z65f6C30,"For audio devices like neckband, tws - OnePlus, Realme , oppo are best pick",7,2025-07-05T10:44:15Z,for audio devices like neckband tws oneplus realme oppo are best pick
Redmi Buds 4 Pro,YouTube,hH6Z65f6C30,"Filpkart Is Biggest Fraudster, I Bought Oppo Enco Buds air 3 pro, Send Me Used ....",0,2025-07-05T05:44:06Z,filpkart is biggest fraudster i bought oppo enco buds air 3 pro send me used
Redmi Buds 4 Pro,YouTube,hH6Z65f6C30,realme buds are for the 1700₹ in there website rn,1,2025-07-05T01:43:38Z,realme buds are for the 1700 in there website rn
Redmi Buds 4 Pro,YouTube,hH6Z65f6C30,"Cmf buds pro 2 is absolutely sh*t and bs piece of trash , i barely get 2 hours of battery backup without the anc mode on, what a waste of money , big disappointment from nothing.",0,2025-07-02T11:03:52Z,cmf buds pro 2 is absolutely sh t and bs piece of trash i barely get 2 hours of battery backup without the anc mode on what a waste of money big disappointment from nothing
Redmi Buds 4 Pro,YouTube,hH6Z65f6C30,Don't purchase CMF..stops working after 1 year😂,0,2025-06-23T14:42:17Z,don t purchase cmf stops working after 1 year
Redmi Buds 4 Pro,YouTube,hH6Z65f6C30,😂😂😂 where is BUDGET part???? All the way priced to 4000 Rs is not budget in any angle,0,2025-06-18T10:14:18Z,where is budget part all the way priced to 4000 rs is not budget in any angle
Redmi Buds 4 Pro,YouTube,hH6Z65f6C30,When did 2500+ become budget 😂,0,2025-06-18T05:53:52Z,when did 2500 become budget
Redmi Buds 4 Pro,YouTube,hH6Z65f6C30,using Realme techlife buds T100 on 3 years best one✌️,0,2025-06-17T19:05:51Z,using realme techlife buds t100 on 3 years best one
Redmi Buds 4 Pro,YouTube,hH6Z65f6C30,My favourite realme wireless 6,0,2025-06-13T12:53:24Z,my favourite realme wireless 6
Redmi Buds 4 Pro,YouTube,hH6Z65f6C30,This guy can sell 💩 also.,0,2025-06-13T01:41:15Z,this guy can sell also
Redmi Buds 4 Pro,YouTube,hH6Z65f6C30,I am using realme t310. Best in the segment. Good audio and calling. Decent ANC.,1,2025-06-06T18:18:22Z,i am using realme t310 best in the segment good audio and calling decent anc
Redmi Buds 4 Pro,YouTube,hH6Z65f6C30,Why people call them earbuds ? So they look like buds they are stem not buds,0,2025-06-05T13:06:30Z,why people call them earbuds so they look like buds they are stem not buds
Redmi Buds 4 Pro,YouTube,hH6Z65f6C30,Realme t310 bought today for 1500 is it good?,0,2025-06-04T18:53:23Z,realme t310 bought today for 1500 is it good
Redmi Buds 4 Pro,YouTube,hH6Z65f6C30,Why are you so excited 😂,0,2025-05-24T11:26:24Z,why are you so excited
Redmi Buds 4 Pro,YouTube,hH6Z65f6C30,Anyone please tell which will be best anc earbuds below 2500,1,2025-05-22T13:55:59Z,anyone please tell which will be best anc earbuds below 2500
Redmi Buds 4 Pro,YouTube,hH6Z65f6C30,Nothing is really unique with their products......Great to see that they are not trying to copy apple like other brands,2,2025-05-21T08:30:23Z,nothing is really unique with their products great to see that they are not trying to copy apple like other brands
Redmi Buds 4 Pro,YouTube,hH6Z65f6C30,Bought CMF buds and it's better than realme and oneplus 🤫,0,2025-05-08T07:18:47Z,bought cmf buds and it s better than realme and oneplus
Redmi Buds 4 Pro,YouTube,hH6Z65f6C30,One plus nord buds 3 has a FKIN 94MS LATENCY,1,2025-05-06T13:32:22Z,one plus nord buds 3 has a fkin 94ms latency
Redmi Buds 4 Pro,YouTube,hH6Z65f6C30,Which is better for call quality?,0,2025-05-06T12:03:09Z,which is better for call quality
Redmi Buds 4 Pro,YouTube,hH6Z65f6C30,Boult klarity 3 No problems till now have been using since last year,0,2025-05-04T13:27:18Z,boult klarity 3 no problems till now have been using since last year
Redmi Buds 4 Pro,YouTube,hH6Z65f6C30,"Can someone pls tell which one i should go for ? 
1) oneplus earbuds 2r
2) oneplus earbuds nord 3",5,2025-05-04T03:52:11Z,can someone pls tell which one i should go for 1 oneplus earbuds 2r 2 oneplus earbuds nord 3
Redmi Buds 4 Pro,YouTube,hH6Z65f6C30,Cmf buds vs realme t310 which is better?,4,2025-05-03T12:52:17Z,cmf buds vs realme t310 which is better
Redmi Buds 4 Pro,YouTube,hH6Z65f6C30,Don't uiu rhink that realme buds air 7 is better than oneplus buds 3 ?,0,2025-05-01T02:22:01Z,don t uiu rhink that realme buds air 7 is better than oneplus buds 3
Redmi Buds 4 Pro,YouTube,hH6Z65f6C30,Been using the oneplus buds 3....and loving it....❤❤,5,2025-04-29T03:11:21Z,been using the oneplus buds 3 and loving it
Redmi Buds 4 Pro,YouTube,hH6Z65f6C30,Using Oppo enco buds 2 for the past 2 years. This is the beast in quality and audio❤,17,2025-04-24T02:26:47Z,using oppo enco buds 2 for the past 2 years this is the beast in quality and audio
Redmi Buds 4 Pro,YouTube,hH6Z65f6C30,When conference and knowledge beat bhengaban🎉🎉🎉🎉🎉🎉🎉,0,2025-04-23T08:21:12Z,when conference and knowledge beat bhengaban
Redmi Buds 4 Pro,YouTube,hH6Z65f6C30,Which one has the lowest latency,0,2025-04-23T07:59:38Z,which one has the lowest latency
Redmi Buds 4 Pro,YouTube,hH6Z65f6C30,I've been using realme tech life t100 for more than 2 years now. Solid TWS @1500. 🔥,16,2025-04-17T11:54:39Z,i ve been using realme tech life t100 for more than 2 years now solid tws 1500
Redmi Buds 4 Pro,YouTube,hH6Z65f6C30,Which is the best,0,2025-04-17T10:20:41Z,which is the best
Redmi Buds 4 Pro,YouTube,hH6Z65f6C30,Realme buds air 6 ?,0,2025-04-14T09:00:22Z,realme buds air 6
Redmi Buds 4 Pro,YouTube,hH6Z65f6C30,I love your background bass beats sound 👌,0,2025-04-11T07:30:37Z,i love your background bass beats sound
Redmi Buds 4 Pro,YouTube,hH6Z65f6C30,"been using one plus buds 3 for a year, and can say it is the best sounding earbuds for the price",0,2025-04-09T12:26:23Z,been using one plus buds 3 for a year and can say it is the best sounding earbuds for the price
Redmi Buds 4 Pro,YouTube,hH6Z65f6C30,Is one plus buds 3 compatible with iPhone?,1,2025-04-07T12:37:16Z,is one plus buds 3 compatible with iphone
Redmi Buds 4 Pro,YouTube,hH6Z65f6C30,If you need the more sound quality go for iems,0,2025-04-06T14:03:38Z,if you need the more sound quality go for iems
Redmi Buds 4 Pro,YouTube,hH6Z65f6C30,"Don't get the cmf buds pro 2, after 6 months of use the battery lasts for barely 30 mins now",0,2025-04-06T07:00:45Z,don t get the cmf buds pro 2 after 6 months of use the battery lasts for barely 30 mins now
Redmi Buds 4 Pro,YouTube,hH6Z65f6C30,The Realme T310 are $1.00 on AliExpress right now 🥰,0,2025-04-05T20:46:57Z,the realme t310 are 1 00 on aliexpress right now
Redmi Buds 4 Pro,YouTube,hH6Z65f6C30,"Nah, Oppo Air 3/2 Pro destroys all of them",0,2025-03-28T02:20:04Z,nah oppo air 3 2 pro destroys all of them
Redmi Buds 4 Pro,YouTube,hH6Z65f6C30,What about pixel buds pro at 8k currently? @sillycornsmedia,0,2025-03-26T03:07:05Z,what about pixel buds pro at 8k currently sillycornsmedia
Redmi Buds 4 Pro,YouTube,hH6Z65f6C30,for 4000 we can get sony tws also..\,2,2025-03-25T06:08:20Z,for 4000 we can get sony tws also
Redmi Buds 4 Pro,YouTube,hH6Z65f6C30,"using the enco buds 1 for the last 3years . Sometimes i face connectivity issues but its not that much of a hassle and the sound quality is just on point , solid value",2,2025-03-19T20:04:30Z,using the enco buds 1 for the last 3years sometimes i face connectivity issues but its not that much of a hassle and the sound quality is just on point solid value
Redmi Buds 4 Pro,YouTube,hH6Z65f6C30,@sillycornsMedia try moondrop space one,0,2025-03-10T03:33:33Z,sillycornsmedia try moondrop space one
Redmi Buds 4 Pro,YouTube,hH6Z65f6C30,"Got boat nirvana for 1399 😊
That 100 hr battery is really great, as I often forget to change",0,2025-03-02T15:10:39Z,got boat nirvana for 1399 that 100 hr battery is really great as i often forget to change
Redmi Buds 4 Pro,YouTube,hH6Z65f6C30,I Purchased last year cmf buds @1900 soon after they launched and now cmf buds pro 2 @3000 as I like its anc & battery life☺️,0,2025-03-02T09:23:07Z,i purchased last year cmf buds 1900 soon after they launched and now cmf buds pro 2 3000 as i like its anc battery life
Redmi Buds 4 Pro,YouTube,hH6Z65f6C30,Boult mustang torq😌,0,2025-03-02T08:36:21Z,boult mustang torq
Redmi Buds 4 Pro,YouTube,hH6Z65f6C30,"What about realme 5 Pro ???
It come also in same price bracket.",1,2025-02-28T11:41:23Z,what about realme 5 pro it come also in same price bracket
Redmi Buds 4 Pro,YouTube,hH6Z65f6C30,Bro forgot what budget is,2,2025-02-25T08:47:24Z,bro forgot what budget is
Redmi Buds 4 Pro,YouTube,hH6Z65f6C30,"i bought dizo gopods neo for 1800 (realme buds q2 similar or maybe exact same) 3 years ago, and it is still better than my parents' tws (boat and noise of 1500 rupees), from 1 2 months, its left earphone feels somewhat less louder than the right one and the left one has also lost its abolity to change normal mode to transparency mode and ANC but these are still so damn good, judt after 6 months of buying it they got out of stock and are still not available to buy, they are definetly worth it",0,2025-02-24T03:20:58Z,i bought dizo gopods neo for 1800 realme buds q2 similar or maybe exact same 3 years ago and it is still better than my parents tws boat and noise of 1500 rupees from 1 2 months its left earphone feels somewhat less louder than the right one and the left one has also lost its abolity to change normal mode to transparency mode and anc but these are still so damn good judt after 6 months of buying it they got out of stock and are still not available to buy they are definetly worth it
Redmi Buds 4 Pro,YouTube,hH6Z65f6C30,Someone look at his eyes 😅,0,2025-02-23T16:40:56Z,someone look at his eyes
Redmi Buds 4 Pro,YouTube,hH6Z65f6C30,Currently using t300,0,2025-02-21T15:31:00Z,currently using t300
Redmi Buds 4 Pro,YouTube,hH6Z65f6C30,You have literally missed Realme buds air 5 pro. Bought it for 4.5k. The best tws at this price.,0,2025-02-20T21:06:18Z,you have literally missed realme buds air 5 pro bought it for 4 5k the best tws at this price
Redmi Buds 4 Pro,YouTube,hH6Z65f6C30,Am i only searching for tws around ₹999 😂,1,2025-02-20T13:16:28Z,am i only searching for tws around 999
Redmi Buds 4 Pro,YouTube,hH6Z65f6C30,What about skull candy? They are really good!,1,2025-02-20T09:42:24Z,what about skull candy they are really good
Redmi Buds 4 Pro,YouTube,hH6Z65f6C30,"Moto Buds were launched for around 4,500 are now available for just 1,999, and I think that's a crazy good deal",16,2025-02-20T03:56:11Z,moto buds were launched for around 4 500 are now available for just 1 999 and i think that s a crazy good deal
Redmi Buds 4 Pro,YouTube,hH6Z65f6C30,Oppp emco buds 2 are the most vfm,0,2025-02-19T20:28:54Z,oppp emco buds 2 are the most vfm
Redmi Buds 4 Pro,YouTube,hH6Z65f6C30,"Oppo enco buds, 2 years now. Insaaane",0,2025-02-19T19:44:14Z,oppo enco buds 2 years now insaaane
Redmi Buds 4 Pro,YouTube,hH6Z65f6C30,No *shame* ....only promoting products based on assumptions.,0,2025-02-19T19:27:38Z,no shame only promoting products based on assumptions
Redmi Buds 4 Pro,YouTube,hH6Z65f6C30,Please make a video on wireless headphones too.,0,2025-02-19T16:59:01Z,please make a video on wireless headphones too
Redmi Buds 4 Pro,YouTube,hH6Z65f6C30,Airdopes 141 any and every day❤❤,0,2025-02-18T20:08:46Z,airdopes 141 any and every day
Redmi Buds 4 Pro,YouTube,hH6Z65f6C30,Can you review boat nirvana ion anc,0,2025-02-18T13:38:16Z,can you review boat nirvana ion anc
Redmi Buds 4 Pro,YouTube,hH6Z65f6C30,"Nothing can beat the Realme t300 in the under 3000 budget as of now. Its sound quality, battery backup and app interface is amazing as well as reliable.",9,2025-02-18T13:17:41Z,nothing can beat the realme t300 in the under 3000 budget as of now its sound quality battery backup and app interface is amazing as well as reliable
Redmi Buds 4 Pro,YouTube,hH6Z65f6C30,Watching this reel using t310 it's really good. Go for it,1,2025-02-18T09:43:03Z,watching this reel using t310 it s really good go for it
Redmi Buds 4 Pro,YouTube,hH6Z65f6C30,"what about anker soundcore r50i?
is it worth it under 1000rs?",0,2025-02-18T03:13:04Z,what about anker soundcore r50i is it worth it under 1000rs
Redmi Buds 4 Pro,YouTube,hH6Z65f6C30,Bro what abt oppo enco air 3 pro?,0,2025-02-17T16:59:16Z,bro what abt oppo enco air 3 pro
Redmi Buds 4 Pro,YouTube,hH6Z65f6C30,"Disclaimer for OnePlus Buds 3: if you don't like shrill highs in your music, don't buy them. The high frequencies are boosted a lot in them. Took me a lot of time to get used to.",0,2025-02-17T16:17:42Z,disclaimer for oneplus buds 3 if you don t like shrill highs in your music don t buy them the high frequencies are boosted a lot in them took me a lot of time to get used to
Redmi Buds 4 Pro,YouTube,hH6Z65f6C30,Got Nothing CMF buds for Rs.1799 best at its price 😎🔥💯,0,2025-02-17T15:56:58Z,got nothing cmf buds for rs 1799 best at its price
Redmi Buds 4 Pro,YouTube,hH6Z65f6C30,Rocking cmf buds 1 and are amazing,0,2025-02-17T14:53:43Z,rocking cmf buds 1 and are amazing
Redmi Buds 4 Pro,YouTube,hH6Z65f6C30,What about realme buds 5 pro,0,2025-02-17T13:02:16Z,what about realme buds 5 pro
Redmi Buds 4 Pro,YouTube,hH6Z65f6C30,I purchased cmf buds pro 2 at Rs 3303/-,0,2025-02-17T08:42:00Z,i purchased cmf buds pro 2 at rs 3303
Redmi Buds 4 Pro,YouTube,hH6Z65f6C30,You mentioned as redmi t310 but is realme bro be cautious,0,2025-02-17T08:24:02Z,you mentioned as redmi t310 but is realme bro be cautious
Redmi Buds 4 Pro,YouTube,hH6Z65f6C30,"OPPO Enco buds 2 is the best tried and tested product, has almost all required features and is selling for 1299 right now.",11,2025-02-17T08:22:00Z,oppo enco buds 2 is the best tried and tested product has almost all required features and is selling for 1299 right now
Redmi Buds 4 Pro,YouTube,hH6Z65f6C30,got the op nord buds 3 for 99 xD,0,2025-02-17T08:07:08Z,got the op nord buds 3 for 99 xd
Redmi Buds 4 Pro,YouTube,hH6Z65f6C30,oppo enco will eat all those buds alone. 🥱,0,2025-02-17T08:05:56Z,oppo enco will eat all those buds alone
Redmi Buds 4 Pro,YouTube,hH6Z65f6C30,Nothing are really really good,0,2025-02-17T08:02:23Z,nothing are really really good
Redmi Buds 4 Pro,YouTube,hH6Z65f6C30,Go for realme air 5 under 2000 in myntra best deal 👌,3,2025-02-17T04:03:51Z,go for realme air 5 under 2000 in myntra best deal
Redmi Buds 4 Pro,YouTube,hH6Z65f6C30,Oppo enco air 3 pro from 5k to 3.2k... Nothing can remotely beat it's sound quality and seperation,3,2025-02-17T03:59:44Z,oppo enco air 3 pro from 5k to 3 2k nothing can remotely beat it s sound quality and seperation
Redmi Buds 4 Pro,YouTube,hH6Z65f6C30,"Stop using tws guys, get ur self wired and save your ears, speaking from experience 😢",0,2025-02-17T02:31:24Z,stop using tws guys get ur self wired and save your ears speaking from experience
Redmi Buds 4 Pro,YouTube,hH6Z65f6C30,had purchased nothing cmf buds for 1600 in Flipkart few months ago,0,2025-02-17T02:12:49Z,had purchased nothing cmf buds for 1600 in flipkart few months ago
Redmi Buds 4 Pro,YouTube,hH6Z65f6C30,I have washed my realme buds t310 2 times now and they are still working fine,2,2025-02-17T00:35:32Z,i have washed my realme buds t310 2 times now and they are still working fine
Redmi Buds 4 Pro,YouTube,hH6Z65f6C30,My oppo enco buds 2 is working amazing after 1.5 years,1,2025-02-16T23:35:10Z,my oppo enco buds 2 is working amazing after 1 5 years
Redmi Buds 4 Pro,YouTube,hH6Z65f6C30,"Recommend me earbuds which have no sound leaks, I bought realme t300 buds and their sound even leaks at 50% volume, I noticed it when some uncle said to me in metro that your earbuds are hearable.",4,2025-02-16T19:54:01Z,recommend me earbuds which have no sound leaks i bought realme t300 buds and their sound even leaks at 50 volume i noticed it when some uncle said to me in metro that your earbuds are hearable
Redmi Buds 4 Pro,YouTube,hH6Z65f6C30,"Thank you for not suggesting JBL, JBL  want to sale it's scrap in india. I have received OTA and my earbuds f.c.kd",0,2025-02-16T19:24:09Z,thank you for not suggesting jbl jbl want to sale it s scrap in india i have received ota and my earbuds f c kd
Redmi Buds 4 Pro,YouTube,hH6Z65f6C30,Why not one discusses realme air 5?,0,2025-02-16T18:43:52Z,why not one discusses realme air 5
Redmi Buds 4 Pro,YouTube,hH6Z65f6C30,Any recommendations for people with small ears? Using the T300 right now and they seem to fall down every now and then!,0,2025-02-16T18:32:05Z,any recommendations for people with small ears using the t300 right now and they seem to fall down every now and then
Redmi Buds 4 Pro,YouTube,hH6Z65f6C30,"I got Realme buds air 6 pro 
For only 3380 rupees
From flipkart 
Was it a good deal ?",0,2025-02-16T17:09:03Z,i got realme buds air 6 pro for only 3380 rupees from flipkart was it a good deal
Redmi Buds 4 Pro,YouTube,hH6Z65f6C30,"I recently bought anker soundcore r50i at just ₹800 which originally launched around ₹2.3k , exceptional at this price of 800 , clear and detailed sound much better than boat , boult , mivi , etc .",7,2025-02-16T16:42:16Z,i recently bought anker soundcore r50i at just 800 which originally launched around 2 3k exceptional at this price of 800 clear and detailed sound much better than boat boult mivi etc
Redmi Buds 4 Pro,YouTube,hH6Z65f6C30,Been using Nothing CMF Buds ( non-pro) for 6 months ... Best deal...i got it in ₹ 1550,8,2025-02-16T16:26:59Z,been using nothing cmf buds non pro for 6 months best deal i got it in 1550
Redmi Buds 4 Pro,YouTube,hH6Z65f6C30,Just buy the roseselsa ceramic x,0,2025-02-16T12:31:33Z,just buy the roseselsa ceramic x
Redmi Buds 4 Pro,YouTube,hH6Z65f6C30,Giveaway me please 😢,0,2025-02-16T11:37:10Z,giveaway me please
Redmi Buds 4 Pro,YouTube,hH6Z65f6C30,CMF would be nice. Hehe,0,2025-02-16T11:32:51Z,cmf would be nice hehe
Redmi Buds 4 Pro,YouTube,hH6Z65f6C30,I want one with the longest battery possible.,0,2025-02-16T11:27:32Z,i want one with the longest battery possible
Redmi Buds 4 Pro,YouTube,hH6Z65f6C30,Soundcore liberty 4nc is the best deal under 5k,0,2025-02-16T11:24:06Z,soundcore liberty 4nc is the best deal under 5k
Redmi Buds 4 Pro,YouTube,hH6Z65f6C30,Hey rupesh please make video on best power bank,0,2025-02-16T10:42:52Z,hey rupesh please make video on best power bank
Redmi Buds 4 Pro,YouTube,hH6Z65f6C30,OPPO enco Air 3 Pro are the best. You won't regret buying it.,76,2025-02-16T09:16:56Z,oppo enco air 3 pro are the best you won t regret buying it
Redmi Buds 4 Pro,YouTube,hH6Z65f6C30,Never spend more than 1000 on any earphones,1,2025-02-16T09:09:25Z,never spend more than 1000 on any earphones
Redmi Buds 4 Pro,YouTube,hH6Z65f6C30,Bro suggest me best gaming tws top tier,0,2025-02-16T09:05:32Z,bro suggest me best gaming tws top tier
Redmi Buds 4 Pro,YouTube,hH6Z65f6C30,"Lmao I've literally been using Galaxy Buds+ for 6 years now (since its launch in 2019) and they haven't aged one bit.

Meanwhile my friends who got the cheap noise and boat brands have had to buy new ones like 3 or 4 times already.",0,2025-02-16T09:00:02Z,lmao i ve literally been using galaxy buds for 6 years now since its launch in 2019 and they haven t aged one bit meanwhile my friends who got the cheap noise and boat brands have had to buy new ones like 3 or 4 times already
Redmi Buds 4 Pro,YouTube,hH6Z65f6C30,just don't think and buy the 1st gen cmf buds absolute best value,1,2025-02-16T08:56:26Z,just don t think and buy the 1st gen cmf buds absolute best value
Redmi Buds 4 Pro,YouTube,hH6Z65f6C30,I am using Sony mdr xb 55 ap most underrated earphones for bass lovers ❤,4,2025-02-16T08:41:38Z,i am using sony mdr xb 55 ap most underrated earphones for bass lovers
Redmi Buds 4 Pro,YouTube,hH6Z65f6C30,"Smartwatch ""smartwatch""",0,2025-02-16T08:35:30Z,smartwatch smartwatch
Redmi Buds 4 Pro,YouTube,hH6Z65f6C30,"Cmf buds vs Oneplus nord 3 buds vs Realme T310, which has better sound quality??",7,2025-02-16T08:34:00Z,cmf buds vs oneplus nord 3 buds vs realme t310 which has better sound quality
Redmi Buds 4 Pro,YouTube,hH6Z65f6C30,"* realme T310 features are good for ₹2k - but no in-ear detection, is it deal breaker 🤔
* realme air 6 pro for ₹4k+ - is it better than T310 ?",1,2025-02-16T08:33:18Z,realme t310 features are good for 2k but no in ear detection is it deal breaker realme air 6 pro for 4k is it better than t310
Redmi Buds 4 Pro,YouTube,hH6Z65f6C30,Realme buds T310 stops working randomly after just 6 months,1,2025-02-16T08:28:19Z,realme buds t310 stops working randomly after just 6 months
Redmi Buds 4 Pro,YouTube,hH6Z65f6C30,"I have non pro nothing earbuds those are good, but bass is muddy., can someone suggest me which one should i buy except Nothing buds",0,2025-02-16T08:27:41Z,i have non pro nothing earbuds those are good but bass is muddy can someone suggest me which one should i buy except nothing buds
Redmi Buds 4 Pro,YouTube,hH6Z65f6C30,Nothing buds pro 2 are the worst earbuds,0,2025-02-16T08:15:27Z,nothing buds pro 2 are the worst earbuds
Redmi Buds 4 Pro,YouTube,hH6Z65f6C30,"Please do a best budget iem video next, coz they are more value for money than Bluetooth earbuds.",3,2025-02-16T08:10:37Z,please do a best budget iem video next coz they are more value for money than bluetooth earbuds
Redmi Buds 4 Pro,YouTube,hH6Z65f6C30,Realme Buds air 6 pro are best in the 4000 price range and galaxy buds 2 pro are best under 7k,3,2025-02-16T08:06:08Z,realme buds air 6 pro are best in the 4000 price range and galaxy buds 2 pro are best under 7k
Redmi Buds 4 Pro,YouTube,hH6Z65f6C30,Nord buds 3 pro are the best for me at 3300,0,2025-02-16T08:05:41Z,nord buds 3 pro are the best for me at 3300
Redmi Buds 4 Pro,YouTube,hH6Z65f6C30,Been using Realme Buds T310 since past 4 months. Got them at around 1600. I can easily say that these are the best earbuds under 2500.,279,2025-02-16T07:46:14Z,been using realme buds t310 since past 4 months got them at around 1600 i can easily say that these are the best earbuds under 2500
Redmi Buds 4 Pro,YouTube,hH6Z65f6C30,"I'll prefer iems over these. Infact, I own one.",0,2025-02-16T07:42:43Z,i ll prefer iems over these infact i own one
Redmi Buds 4 Pro,YouTube,hH6Z65f6C30,Airdopes 800? Plss help 😊,0,2025-02-16T07:35:30Z,airdopes 800 plss help
Redmi Buds 4 Pro,YouTube,hH6Z65f6C30,Best headphones to buy? I had purchased a boat rockerz 550. But the leather material is coming in just one year. Really disappointed with them,0,2025-02-16T07:32:02Z,best headphones to buy i had purchased a boat rockerz 550 but the leather material is coming in just one year really disappointed with them
Redmi Buds 4 Pro,YouTube,hH6Z65f6C30,Cmf buds or buds pro 2,0,2025-02-16T07:31:12Z,cmf buds or buds pro 2
