Model,Source,VideoID,Comment,Likes,PublishedAt,Clean_Text
Redmi Buds 5,YouTube,W4JRhZpEEQ0,"Hii Mx Tech, i buyed Redmi 5 Pro earbuds and i really cant feel any noise cancell , i put it in deep mode and i really dont feel some noise cancell , what is going on ? ☹️ It changing the quality of sound its true but i dont feel some noise cancell. Those 52 Db they mention .",3,2024-03-13T17:52:23Z,hii mx tech i buyed redmi 5 pro earbuds and i really cant feel any noise cancell i put it in deep mode and i really dont feel some noise cancell what is going on it changing the quality of sound its true but i dont feel some noise cancell those 52 db they mention
Redmi Buds 5,YouTube,W4JRhZpEEQ0,Or soundpeats air4pro?,0,2024-03-11T14:01:44Z,or soundpeats air4pro
Redmi Buds 5,YouTube,dMOyQttxgeo,Redmi buds 6 pro vs Xiaomi buds 5. Which one is the best?,0,2025-12-26T00:58:31Z,redmi buds 6 pro vs xiaomi buds 5 which one is the best
Redmi Buds 5,YouTube,dMOyQttxgeo,Great review!! All I needed thanks 🙏,0,2025-11-22T07:25:40Z,great review all i needed thanks
Redmi Buds 5,YouTube,dMOyQttxgeo,yeah mi is great =),0,2025-07-15T19:29:14Z,yeah mi is great
Redmi Buds 5,YouTube,dMOyQttxgeo,"I find the sound total crap. As they to not close the soundway to the ear due to the absence of a silicon tip the ANC does absolutely nothing for me, I hear not a blink of a difference. To me these buds are the biggest disappointment from Xiaomi ever.",0,2025-07-09T04:39:38Z,i find the sound total crap as they to not close the soundway to the ear due to the absence of a silicon tip the anc does absolutely nothing for me i hear not a blink of a difference to me these buds are the biggest disappointment from xiaomi ever
Redmi Buds 5,YouTube,dMOyQttxgeo,Have you done a Honor earbuds S7 review?,0,2025-05-23T06:28:07Z,have you done a honor earbuds s7 review
Redmi Buds 5,YouTube,dMOyQttxgeo,Will this work good on Xiaomi 15?,0,2025-05-04T18:45:33Z,will this work good on xiaomi 15
Redmi Buds 5,YouTube,dMOyQttxgeo,"Click supper makes any earbuds useless, it will always move outta place from your ear and have to readjust",0,2025-04-13T00:12:15Z,click supper makes any earbuds useless it will always move outta place from your ear and have to readjust
Redmi Buds 5,YouTube,dMOyQttxgeo,I have this and used it for a good chunk of time. All I can say is that it has horrendous battery life like borderline batshit unreliable. You listen to 3 to 4 songs and it will cut around 10% of the battery life,2,2025-03-25T10:13:21Z,i have this and used it for a good chunk of time all i can say is that it has horrendous battery life like borderline batshit unreliable you listen to 3 to 4 songs and it will cut around 10 of the battery life
Redmi Buds 5,YouTube,dMOyQttxgeo,The squeeze controls I prefer as touch controls and very annoying. I actually like the sound of these ones.,0,2025-02-06T21:30:17Z,the squeeze controls i prefer as touch controls and very annoying i actually like the sound of these ones
Redmi Buds 5,YouTube,dMOyQttxgeo,"This  earbuds are beautiful, but they’re not for everyone. The design is bulkier and doesn’t fit well in smaller ears. Additionally, the smooth texture and material cause them to slip, especially after prolonged use when natural earwax exacerbates the issue. This becomes problematic when the auto-pause feature is activated, as the sensor detects the earbud as removed even with slight head or mouth movements, or even talking.

The sound quality is excellent, with great volume and ambient effects. Noise cancellation works decently in terms of software, but due to the poor fit, it doesn’t perform well.

----------------
Os fones são lindos, mas não são para todos. O design do fone de ouvido é mais gordinho, e não se encaixa bem em ouvidos pequenos, além disso pelo material e pela textura muito lisa, fazem  eles escorregarem facilmente principalmente depois de algum tempo de uso onde a cera natural do ouvido potencializa . Tem um agravante quando esta ativado o auto-pause quando se retira o earphone, pois por ter essa falha no encaixe o sensor interpreta que o phone retirado o tempo todo, mesmo quando isso não é retirado, basta um leve movimento da cabeça, ou da boca, até mesmo falar pode fazer que o sensor entenda que o earphone foi retirado.

O som é excelente, tem um otimo volume, os efeitos de ambiente, e noise cancelation funciona razoavelmente em termos de software, mas devido a essa falha no encaixe nao funcionam bem",0,2025-01-16T19:42:10Z,this earbuds are beautiful but they re not for everyone the design is bulkier and doesn t fit well in smaller ears additionally the smooth texture and material cause them to slip especially after prolonged use when natural earwax exacerbates the issue this becomes problematic when the auto pause feature is activated as the sensor detects the earbud as removed even with slight head or mouth movements or even talking the sound quality is excellent with great volume and ambient effects noise cancellation works decently in terms of software but due to the poor fit it doesn t perform well os fones s o lindos mas n o s o para todos o design do fone de ouvido mais gordinho e n o se encaixa bem em ouvidos pequenos al m disso pelo material e pela textura muito lisa fazem eles escorregarem facilmente principalmente depois de algum tempo de uso onde a cera natural do ouvido potencializa tem um agravante quando esta ativado o auto pause quando se retira o earphone pois por ter essa falha no encaixe o sensor interpreta que o phone retirado o tempo todo mesmo quando isso n o retirado basta um leve movimento da cabe a ou da boca at mesmo falar pode fazer que o sensor entenda que o earphone foi retirado o som excelente tem um otimo volume os efeitos de ambiente e noise cancelation funciona razoavelmente em termos de software mas devido a essa falha no encaixe nao funcionam bem
Redmi Buds 5,YouTube,dMOyQttxgeo,Your left ear is right for us!,0,2024-12-26T12:27:36Z,your left ear is right for us
Redmi Buds 5,YouTube,dMOyQttxgeo,I want to get these but I'm afraid it would fall off when I do my everyday commute... I'm used to redmi bud 5 pro not falling of no matter what I do lol,0,2024-12-22T11:02:14Z,i want to get these but i m afraid it would fall off when i do my everyday commute i m used to redmi bud 5 pro not falling of no matter what i do lol
Redmi Buds 5,YouTube,dMOyQttxgeo,the best guide keep the good work bro !!!,0,2024-12-15T22:22:31Z,the best guide keep the good work bro
Redmi Buds 5,YouTube,dMOyQttxgeo,Why do you call them shiaomy?😂,0,2024-12-15T05:55:56Z,why do you call them shiaomy
Redmi Buds 5,YouTube,dMOyQttxgeo,What is best xiaomi buds 5 or redmi buds 5 pro? Plz help.,1,2024-12-14T19:50:58Z,what is best xiaomi buds 5 or redmi buds 5 pro plz help
Redmi Buds 5,YouTube,dMOyQttxgeo,Between Xiaomi Buds 5 or CMF Buds pro 2 which is better?,0,2024-11-16T17:02:04Z,between xiaomi buds 5 or cmf buds pro 2 which is better
Redmi Buds 5,YouTube,dMOyQttxgeo,"Thanks for the review.
Can i configure the call recording to record all calls? Or i have to trigger it for every single call?",0,2024-11-12T13:36:57Z,thanks for the review can i configure the call recording to record all calls or i have to trigger it for every single call
Redmi Buds 5,YouTube,dMOyQttxgeo,"This is one of the best TWS I have ever used. The comfort is outstanding, and the dual connectivity works flawlessly with both my laptop and mobile, making it ideal for office use. The sound quality is amazing, and the click-and-swipe volume control is a fantastic feature. Call recording also works well, even for WhatsApp calls.",9,2024-11-10T08:37:37Z,this is one of the best tws i have ever used the comfort is outstanding and the dual connectivity works flawlessly with both my laptop and mobile making it ideal for office use the sound quality is amazing and the click and swipe volume control is a fantastic feature call recording also works well even for whatsapp calls
Redmi Buds 5,YouTube,dMOyQttxgeo,i am on the hunt to buy a pair for earbuds ( not in-ears with the elastic tip ) for a friend ! I was checking those and the Samsung Galaxy Buds 3 ! For the samsung's the comments are that they dont fit well on/in the ears ! Does anyone has experience from both ?,0,2024-11-07T18:23:21Z,i am on the hunt to buy a pair for earbuds not in ears with the elastic tip for a friend i was checking those and the samsung galaxy buds 3 for the samsung s the comments are that they dont fit well on in the ears does anyone has experience from both
Redmi Buds 5,YouTube,dMOyQttxgeo,Is the gesture really hard to use?,0,2024-10-23T12:30:21Z,is the gesture really hard to use
Redmi Buds 5,YouTube,dMOyQttxgeo,Snapdragon sound codec is amazing,0,2024-10-22T10:02:01Z,snapdragon sound codec is amazing
Redmi Buds 5,YouTube,dMOyQttxgeo,"I was searching high and low for buds without silicon tips and ended up getting the Samsung buds 3. The only thing I'm down on is Samsung not including support for multi device pairing for the purposes of locking you in because it works across Samsung devices. I absolutely love the fit of the buds 3 so I'm happy over all. Oh and something else I'm not crzy about is that to because of their triangular stems, they don't go in the case as easy as something like Airpods.",1,2024-10-19T22:59:00Z,i was searching high and low for buds without silicon tips and ended up getting the samsung buds 3 the only thing i m down on is samsung not including support for multi device pairing for the purposes of locking you in because it works across samsung devices i absolutely love the fit of the buds 3 so i m happy over all oh and something else i m not crzy about is that to because of their triangular stems they don t go in the case as easy as something like airpods
Redmi Buds 5,YouTube,dMOyQttxgeo,Is it better than REALME buds air pro 6???,0,2024-10-12T10:00:09Z,is it better than realme buds air pro 6
Redmi Buds 5,YouTube,dMOyQttxgeo,Bass doesn't exist in these buds 😢,0,2024-10-10T13:46:04Z,bass doesn t exist in these buds
Redmi Buds 5,YouTube,dMOyQttxgeo,Can this be paired with iphone?,1,2024-10-10T03:21:01Z,can this be paired with iphone
Redmi Buds 5,YouTube,dMOyQttxgeo,Does it support wireless charging? xiaomi Buds 5,2,2024-10-07T19:27:09Z,does it support wireless charging xiaomi buds 5
Redmi Buds 5,YouTube,dMOyQttxgeo,"i got my pair today, and i have to say they are apsolutely awesome. top notch sound quality and very customizable thru the app, you can basicaly make them sound how ever you prefer.
all those features i thought i wouldnt use are acctually really usefull... but be aware, if you dont have a xiaomi/redmi device with hyper OS and a qualcom snapdragon chipset you will not be able to use all of its potential. that said, they are are extremly high value for the money, i paid 99€ and i dont regret it at all. for sure top tier earbuds at that price range.
the only thing that i have to complain about are the touch/push buttons on the buds, they seem a little bit scatchy and somewhat strange to use, other than that really nice product from xiaomi.",9,2024-10-07T11:34:46Z,i got my pair today and i have to say they are apsolutely awesome top notch sound quality and very customizable thru the app you can basicaly make them sound how ever you prefer all those features i thought i wouldnt use are acctually really usefull but be aware if you dont have a xiaomi redmi device with hyper os and a qualcom snapdragon chipset you will not be able to use all of its potential that said they are are extremly high value for the money i paid 99 and i dont regret it at all for sure top tier earbuds at that price range the only thing that i have to complain about are the touch push buttons on the buds they seem a little bit scatchy and somewhat strange to use other than that really nice product from xiaomi
Redmi Buds 5,YouTube,dMOyQttxgeo,Is it have transparency mode?,1,2024-10-06T04:15:32Z,is it have transparency mode
Redmi Buds 5,YouTube,dMOyQttxgeo,So how's the actual sound? Is it good or is it bad?,0,2024-10-05T10:51:57Z,so how s the actual sound is it good or is it bad
Redmi Buds 5,YouTube,dMOyQttxgeo,this or the Redmi Buds 5 Pro?,0,2024-10-05T09:24:30Z,this or the redmi buds 5 pro
Redmi Buds 5,YouTube,dMOyQttxgeo,Anyone encountered a problem with the gestures? Mine's not working. Firmware up to date,2,2024-10-05T08:37:46Z,anyone encountered a problem with the gestures mine s not working firmware up to date
Redmi Buds 5,YouTube,dMOyQttxgeo,Is it comfortable to wear compared to the rubber tipped redmi buds series ?,1,2024-10-05T07:03:18Z,is it comfortable to wear compared to the rubber tipped redmi buds series
Redmi Buds 5,YouTube,dMOyQttxgeo,What's the sound leakage like on these,1,2024-10-03T06:39:03Z,what s the sound leakage like on these
Redmi Buds 5,YouTube,dMOyQttxgeo,"Hello Bro,

Could you please provide a score between 0 and 10 for the phone call mic quality on the Xiaomi Buds 5 TWS, along with valid reasons for your rating?

Thank you Brother 🙏🙂👍",3,2024-10-01T15:17:01Z,hello bro could you please provide a score between 0 and 10 for the phone call mic quality on the xiaomi buds 5 tws along with valid reasons for your rating thank you brother
Redmi Buds 5,YouTube,dMOyQttxgeo,Could you please quickly compare them to the Buds 4 Pro ? Thanks,0,2024-10-01T14:10:41Z,could you please quickly compare them to the buds 4 pro thanks
Redmi Buds 5,YouTube,dMOyQttxgeo,I already have Xiaomi Buds 4 Pro (1 year old). Do you think it is worth to buy new ones?,1,2024-10-01T07:41:49Z,i already have xiaomi buds 4 pro 1 year old do you think it is worth to buy new ones
Redmi Buds 5,YouTube,dMOyQttxgeo,Is the mic better in calls than buds 5 pro?,0,2024-09-30T19:28:33Z,is the mic better in calls than buds 5 pro
Redmi Buds 5,YouTube,dMOyQttxgeo,Very informative video. Thanks!  i was looking forward to buy them.,0,2024-09-30T11:57:38Z,very informative video thanks i was looking forward to buy them
Redmi Buds 5,YouTube,dMOyQttxgeo,So the mics work also when I am recording video with the XIaomi phone? So even if I have them connected the buds record the audio in best quality (as they don't have to send them over via bluetooth) and I can sync up the audio later in post? Basically a DJI Mic2 with earbuds attached with slighlty worse sound quality I guess?,1,2024-09-30T09:00:47Z,so the mics work also when i am recording video with the xiaomi phone so even if i have them connected the buds record the audio in best quality as they don t have to send them over via bluetooth and i can sync up the audio later in post basically a dji mic2 with earbuds attached with slighlty worse sound quality i guess
Redmi Buds 5,YouTube,dMOyQttxgeo,Is it better than OnePlus buds 3?,1,2024-09-29T11:07:43Z,is it better than oneplus buds 3
Redmi Buds 5,YouTube,dMOyQttxgeo,"Very interesting, that record on device could be very useful, also looks great and not like a copy or refresh of many others even when there is not much room to change the design",1,2024-09-27T10:41:53Z,very interesting that record on device could be very useful also looks great and not like a copy or refresh of many others even when there is not much room to change the design
Redmi Buds 5,YouTube,dMOyQttxgeo,Is it better than Redmi Buds 5 Pro?,13,2024-09-27T02:31:35Z,is it better than redmi buds 5 pro
Redmi Buds 5,YouTube,dMOyQttxgeo,"It wasnt said in the video but it also comes with a 3 month Spotify premium subscription, im seriously thinking of buying these even though i just got my moondrop ultrasonic s",5,2024-09-27T02:17:30Z,it wasnt said in the video but it also comes with a 3 month spotify premium subscription im seriously thinking of buying these even though i just got my moondrop ultrasonic s
Redmi Buds 5,YouTube,dMOyQttxgeo,"@2:20 I don't need touch inputs on the sides... this is perfect for me.

Thanks for pointing this out!",7,2024-09-27T02:16:52Z,2 20 i don t need touch inputs on the sides this is perfect for me thanks for pointing this out
Redmi Buds 5,YouTube,dMOyQttxgeo,The recording function is super useful! I think I might get those,5,2024-09-26T21:43:47Z,the recording function is super useful i think i might get those
Redmi Buds 5,YouTube,dMOyQttxgeo,ANC Art the level of Sony?,0,2024-09-26T21:20:32Z,anc art the level of sony
Redmi Buds 5,YouTube,dMOyQttxgeo,"Do you have the Huawei Freebuds 4 by any chance? Are the Buds 5 bigger, or smaller?",0,2024-09-26T17:59:21Z,do you have the huawei freebuds 4 by any chance are the buds 5 bigger or smaller
Redmi Buds 5,YouTube,81no0fY541g,Yay baat I like the way you use that device,1,2024-03-16T08:07:26Z,yay baat i like the way you use that device
Redmi Buds 5,YouTube,81no0fY541g,"Calling ke liye sabse best earbuds
Btaye  under 1500-2000 tk
Please 🙏🙏🙏",0,2024-03-15T18:20:37Z,calling ke liye sabse best earbuds btaye under 1500 2000 tk please
Redmi Buds 5,YouTube,81no0fY541g,Sir redmi buds 5 vs realme t300 which is better? Specially in terms of music and bass. I love best bass,0,2024-03-14T18:30:40Z,sir redmi buds 5 vs realme t300 which is better specially in terms of music and bass i love best bass
Redmi Buds 5,YouTube,Az-Kygq9XQs,"Bro stay neutral from start your gesture, your content, your communication way is weight down more for oneplus buds rather than redmi and it is clearly seen",0,2025-10-04T14:29:58Z,bro stay neutral from start your gesture your content your communication way is weight down more for oneplus buds rather than redmi and it is clearly seen
Redmi Buds 5,YouTube,Az-Kygq9XQs,Redmi ear buds 5 will slip more in sweat time.,0,2025-09-30T07:35:39Z,redmi ear buds 5 will slip more in sweat time
Redmi Buds 5,YouTube,Az-Kygq9XQs,I'm getting redmi buds 5 for 1623 what to do?,2,2025-09-20T08:34:18Z,i m getting redmi buds 5 for 1623 what to do
Redmi Buds 5,YouTube,Az-Kygq9XQs,Dono mese kiska Bass or clarity Badiya plz reply bro,0,2025-01-26T21:47:39Z,dono mese kiska bass or clarity badiya plz reply bro
Redmi Buds 5,YouTube,Az-Kygq9XQs,One plus2 or koi phone m bhi Badiya chalegi bro,0,2025-01-26T21:26:42Z,one plus2 or koi phone m bhi badiya chalegi bro
Redmi Buds 5,YouTube,Az-Kygq9XQs,Bought oppo eco buds2 1300 two days back .now redmi buds 5 1299 offer 😢 is it better than oppo,0,2024-10-02T17:22:36Z,bought oppo eco buds2 1300 two days back now redmi buds 5 1299 offer is it better than oppo
Redmi Buds 5,YouTube,Az-Kygq9XQs,"Oneplus nord 2 earbud vs sony wf-c700n

Pls suggest which is betttter?",0,2024-09-30T02:22:40Z,oneplus nord 2 earbud vs sony wf c700n pls suggest which is betttter
Redmi Buds 5,YouTube,Az-Kygq9XQs,Now One Plus Buds Nord 2 and Realme Buds 5 are 1999 which is the best at this Cost can you Tell soon Bro!??? I'm confused,0,2024-09-29T09:38:28Z,now one plus buds nord 2 and realme buds 5 are 1999 which is the best at this cost can you tell soon bro i m confused
Redmi Buds 5,YouTube,Az-Kygq9XQs,Got Redmi Buds 5 in 1799 only 😊,1,2024-09-28T20:03:15Z,got redmi buds 5 in 1799 only
Redmi Buds 5,YouTube,Az-Kygq9XQs,which are more comfortable for long duration?,0,2024-09-26T16:53:18Z,which are more comfortable for long duration
Redmi Buds 5,YouTube,Az-Kygq9XQs,"Hi bro what you will suggest 
1) cmf buds =2000
2)redmi buds 5= 2500",0,2024-07-20T09:51:47Z,hi bro what you will suggest 1 cmf buds 2000 2 redmi buds 5 2500
Redmi Buds 5,YouTube,Az-Kygq9XQs,But in offline redmi buds 5 is ₹2500 directly,0,2024-05-09T09:23:10Z,but in offline redmi buds 5 is 2500 directly
Redmi Buds 5,YouTube,Az-Kygq9XQs,sir best calling tws under 3000   i hope you best suggestion 🙂,1,2024-05-04T15:37:02Z,sir best calling tws under 3000 i hope you best suggestion
Redmi Buds 5,YouTube,Az-Kygq9XQs,"One plus Nord buds 2 earbuds are awesome!! The media audio quality is amazing, call audio is definitely an upgrade from the previous model. Im absolutely glad that I decided to purchase these earbuds and will definitely recommend!!",2,2024-04-28T19:23:58Z,one plus nord buds 2 earbuds are awesome the media audio quality is amazing call audio is definitely an upgrade from the previous model im absolutely glad that i decided to purchase these earbuds and will definitely recommend
Redmi Buds 5,YouTube,Az-Kygq9XQs,"Sir I Am Using OnePlus Nord 2, 
So Can I Go With OnePlus Nord buds 2",0,2024-04-18T04:15:24Z,sir i am using oneplus nord 2 so can i go with oneplus nord buds 2
Redmi Buds 5,YouTube,Az-Kygq9XQs,"Redmi buds 5 vs realme buds air 5 
Which is best",0,2024-04-17T10:26:53Z,redmi buds 5 vs realme buds air 5 which is best
Redmi Buds 5,YouTube,Az-Kygq9XQs,Sabse bakwas one plus h battery backup me waste of money,0,2024-04-12T01:27:52Z,sabse bakwas one plus h battery backup me waste of money
Redmi Buds 5,YouTube,Az-Kygq9XQs,Got oneplus nord buds 2 for just 2150😁,2,2024-04-06T15:44:07Z,got oneplus nord buds 2 for just 2150
Redmi Buds 5,YouTube,Az-Kygq9XQs,"Flipkart sale price currently
Oneplus -2.2 k
Redmi -2.5k",2,2024-04-01T06:16:57Z,flipkart sale price currently oneplus 2 2 k redmi 2 5k
Redmi Buds 5,YouTube,Az-Kygq9XQs,Mi buds vs cmf buds vs boat Nirvana ion anc which is best for calling and for using in laptop,1,2024-03-29T08:33:16Z,mi buds vs cmf buds vs boat nirvana ion anc which is best for calling and for using in laptop
Redmi Buds 5,YouTube,Az-Kygq9XQs,"Hey, can someone translate what the conclusion was?",0,2024-03-28T22:59:27Z,hey can someone translate what the conclusion was
Redmi Buds 5,YouTube,Az-Kygq9XQs,Bri jbl wave flex earbuds calling test,0,2024-03-25T15:15:25Z,bri jbl wave flex earbuds calling test
Redmi Buds 5,YouTube,Az-Kygq9XQs,Can you suggest me which tws is better for gym under 2000 rs,0,2024-03-20T07:28:43Z,can you suggest me which tws is better for gym under 2000 rs
Redmi Buds 5,YouTube,Az-Kygq9XQs,Sir please suggest me a buds with ANC with app support under 3k,0,2024-03-18T09:42:06Z,sir please suggest me a buds with anc with app support under 3k
Redmi Buds 5,YouTube,Az-Kygq9XQs,Nice review brother keep it up and I hope you reach 3 million subscribers thank you,2,2024-03-16T02:55:49Z,nice review brother keep it up and i hope you reach 3 million subscribers thank you
Redmi Buds 5,YouTube,Az-Kygq9XQs,Compare with Realme buds T300 😊,0,2024-03-10T13:08:27Z,compare with realme buds t300
Redmi Buds 5,YouTube,Az-Kygq9XQs,Case dhakkan kholne par auto connect h kya,0,2024-03-04T22:12:36Z,case dhakkan kholne par auto connect h kya
Redmi Buds 5,YouTube,Az-Kygq9XQs,Bro plz review jbl tune130c usb c 😢 it’s newly launched and there is no vedio on entire YouTube 😢😢😢,0,2024-03-04T07:35:28Z,bro plz review jbl tune130c usb c it s newly launched and there is no vedio on entire youtube
Redmi Buds 5,YouTube,Az-Kygq9XQs,Buds aren't worth it. They hardly last 1 - 2 years,2,2024-03-03T15:07:27Z,buds aren t worth it they hardly last 1 2 years
Redmi Buds 5,YouTube,Az-Kygq9XQs,Thank you amazing testing 👌👌,1,2024-03-03T13:40:01Z,thank you amazing testing
Redmi Buds 5,YouTube,Az-Kygq9XQs,I want best earphones under 3000 ? For Music and calling,0,2024-03-03T09:13:42Z,i want best earphones under 3000 for music and calling
Redmi Buds 5,YouTube,Az-Kygq9XQs,Compare with CMF buds pro,2,2024-03-03T04:30:01Z,compare with cmf buds pro
Redmi Buds 5,YouTube,Az-Kygq9XQs,"Hi Bro, When can we expect the video review for the Boult Z40 Ultra?",0,2024-03-02T14:15:47Z,hi bro when can we expect the video review for the boult z40 ultra
Redmi Buds 5,YouTube,Az-Kygq9XQs,Bro does cmf buds connects laptops. I’m taking online couching. People are saying it doesn’t connects with laptops. Im confused. Please please reply bro,2,2024-03-02T11:59:04Z,bro does cmf buds connects laptops i m taking online couching people are saying it doesn t connects with laptops im confused please please reply bro
Redmi Buds 5,YouTube,Az-Kygq9XQs,"Redmi has the concept and the means but this headset is too buggy. Sometimes the tap doesn’t work, the in ear is buggy too. It dont let the music or video play back when you put the earphones back. For me the headache isnt worth the price for this one. But i hope they update the software. Then it will be worth it, but right now its not.",0,2024-03-02T08:35:12Z,redmi has the concept and the means but this headset is too buggy sometimes the tap doesn t work the in ear is buggy too it dont let the music or video play back when you put the earphones back for me the headache isnt worth the price for this one but i hope they update the software then it will be worth it but right now its not
Redmi Buds 5,YouTube,Az-Kygq9XQs,Redmi buds 5 vs Realme T300 review plz,0,2024-03-02T05:37:19Z,redmi buds 5 vs realme t300 review plz
Redmi Buds 5,YouTube,Az-Kygq9XQs,"I was literally waiting for the DRS, and now I'm 100% sure. I wasn't able to tell the difference either...so yes. She is unbiased for sure 👏",0,2024-03-02T03:01:17Z,i was literally waiting for the drs and now i m 100 sure i wasn t able to tell the difference either so yes she is unbiased for sure
Redmi Buds 5,YouTube,Az-Kygq9XQs,Which has best anc,0,2024-03-01T20:17:16Z,which has best anc
Redmi Buds 5,YouTube,Az-Kygq9XQs,"I want to buy earbuds with best outdoor performance, please suggest between not just these two but any earbuds under 3000 whichever you find best for outdoor calling, thanks waiting for reply! Love your videos ✨",1,2024-03-01T18:21:09Z,i want to buy earbuds with best outdoor performance please suggest between not just these two but any earbuds under 3000 whichever you find best for outdoor calling thanks waiting for reply love your videos
Redmi Buds 5,YouTube,Az-Kygq9XQs,"Can someone suggest me tws or neckband under 2k
With best sound quality and good battery and decent build quality",1,2024-03-01T15:10:35Z,can someone suggest me tws or neckband under 2k with best sound quality and good battery and decent build quality
