Model,Source,VideoID,Comment,Likes,PublishedAt,Clean_Text
Redmi Buds 4,YouTube,OQ_f9JItp7w,"Bhai isko mat lharido, mai bolraha hu, thora aur add karke oppo enco buds 2 kharido, usme orbhi syada features hai or sound quality is fire",3,2023-06-18T08:19:00Z,bhai isko mat lharido mai bolraha hu thora aur add karke oppo enco buds 2 kharido usme orbhi syada features hai or sound quality is fire
Redmi Buds 4,YouTube,OQ_f9JItp7w,Mere friend ko buy karna hai this one or oppo enco buds 2 overall which one is better.,2,2023-06-18T05:58:59Z,mere friend ko buy karna hai this one or oppo enco buds 2 overall which one is better
Redmi Buds 4,YouTube,OQ_f9JItp7w,Which earbuds is best BOAT VS REDMI??,1,2023-06-17T20:15:01Z,which earbuds is best boat vs redmi
Redmi Buds 4,YouTube,OQ_f9JItp7w,Boat Vs redmi which is besttt???,2,2023-06-17T20:14:41Z,boat vs redmi which is besttt
Redmi Buds 4,YouTube,OQ_f9JItp7w,Realme tech t100 or noise vs401 which is bes,2,2023-06-17T14:53:04Z,realme tech t100 or noise vs401 which is bes
Redmi Buds 4,YouTube,OQ_f9JItp7w,Bro kya ye buds Redmi Note 10S mei Connect honge kya?,2,2023-06-17T14:47:07Z,bro kya ye buds redmi note 10s mei connect honge kya
Redmi Buds 4,YouTube,OQ_f9JItp7w,Laptop se bhi connect hoga ya nahi via bluetooth?????❓❓❓❓❓❓❓❓❓❓❓,2,2023-06-17T13:00:50Z,laptop se bhi connect hoga ya nahi via bluetooth
Redmi Buds 4,YouTube,OQ_f9JItp7w,"I am a big follower of you. Can you please suggest.
I am a IT professional. Want to buy one tablet under 60k which One I pick.Ipad air 5th gen or Galaxy S8plus. Priority Display, battery, UI experience. I haven't use any apple products yet.",4,2023-06-17T10:50:31Z,i am a big follower of you can you please suggest i am a it professional want to buy one tablet under 60k which one i pick ipad air 5th gen or galaxy s8plus priority display battery ui experience i haven t use any apple products yet
Redmi Buds 4,YouTube,OQ_f9JItp7w,Call quality is better or not,3,2023-06-17T09:58:38Z,call quality is better or not
Redmi Buds 4,YouTube,OQ_f9JItp7w,bro i messaged on instagram about my watch problem i am from nepal !i bought the watch in india but within 3 months of the watch the touch of the watch stopped working !,6,2023-06-17T09:47:55Z,bro i messaged on instagram about my watch problem i am from nepal i bought the watch in india but within 3 months of the watch the touch of the watch stopped working
Redmi Buds 4,YouTube,OQ_f9JItp7w,Very nice product apke review ka hi me wait kr rha tha ❤❤,9,2023-06-17T09:40:02Z,very nice product apke review ka hi me wait kr rha tha
Redmi Buds 4,YouTube,BAQOlYb0bZg,Your cargo pant link please,0,2024-02-06T09:40:22Z,your cargo pant link please
Redmi Buds 4,YouTube,BAQOlYb0bZg,Bro what's that watch you are wearing??,1,2023-10-16T15:29:54Z,bro what s that watch you are wearing
Redmi Buds 4,YouTube,BAQOlYb0bZg,What about Dolby Atmos,6,2023-06-21T13:18:00Z,what about dolby atmos
Redmi Buds 4,YouTube,BAQOlYb0bZg,Third class product,2,2023-06-21T08:10:58Z,third class product
Redmi Buds 4,YouTube,BAQOlYb0bZg,"Is it available on flipkart
If not, will it? & when?",4,2023-06-20T06:43:00Z,is it available on flipkart if not will it when
Redmi Buds 4,YouTube,BAQOlYb0bZg,For I phone not so much ??,1,2023-06-15T18:45:04Z,for i phone not so much
Redmi Buds 4,YouTube,BAQOlYb0bZg,Bro what about gaming?,5,2023-06-14T19:04:08Z,bro what about gaming
Redmi Buds 4,YouTube,BAQOlYb0bZg,there is app support,1,2023-06-14T18:39:25Z,there is app support
Redmi Buds 4,YouTube,BAQOlYb0bZg,Bro which watch u wear,1,2023-06-14T17:00:13Z,bro which watch u wear
Redmi Buds 4,YouTube,BAQOlYb0bZg,Bro under  2000 suggest me a best all-round tws buds,10,2023-06-14T08:21:17Z,bro under 2000 suggest me a best all round tws buds
Redmi Buds 4,YouTube,EqJgc1UVqh4,Me listening it while wearing redmi buds 4 active,0,2025-06-17T15:38:48Z,me listening it while wearing redmi buds 4 active
Redmi Buds 4,YouTube,EqJgc1UVqh4,"😂 bruh for real,  The eq are just opposite of what you said. The low end frequencies are boosted and the high are dumped. Good for 808 hiphop not best for metals, crisp sounds.",0,2024-10-04T12:53:30Z,bruh for real the eq are just opposite of what you said the low end frequencies are boosted and the high are dumped good for 808 hiphop not best for metals crisp sounds
Redmi Buds 4,YouTube,EqJgc1UVqh4,can we do NEXT songs by double tapping Right Buds Or Left Buds OR Both buds.,0,2024-08-28T17:09:40Z,can we do next songs by double tapping right buds or left buds or both buds
Redmi Buds 4,YouTube,EqJgc1UVqh4,is lenovo LP5 better or this one??,0,2024-08-13T11:11:16Z,is lenovo lp5 better or this one
Redmi Buds 4,YouTube,EqJgc1UVqh4,"Bhai ka confidence 📈, bhai ki knowledge 📉",0,2024-07-20T20:11:21Z,bhai ka confidence bhai ki knowledge
Redmi Buds 4,YouTube,EqJgc1UVqh4,"Which is better redmi buds 4 lite or remi buds 4 active?

And one more question.

If i use redmi bud 4 active with remi ph,  do i have download the app also?",4,2024-06-23T01:19:21Z,which is better redmi buds 4 lite or remi buds 4 active and one more question if i use redmi bud 4 active with remi ph do i have download the app also
Redmi Buds 4,YouTube,EqJgc1UVqh4,no warranty card?,1,2024-06-14T06:53:02Z,no warranty card
Redmi Buds 4,YouTube,EqJgc1UVqh4,Learn from selling allooo laa looo,0,2024-04-08T03:46:24Z,learn from selling allooo laa looo
Redmi Buds 4,YouTube,EqJgc1UVqh4,Touch control hai kaya,0,2024-03-17T04:19:46Z,touch control hai kaya
Redmi Buds 4,YouTube,EqJgc1UVqh4,"Banda sahi bol rha hain be 
Ye gaming ke liye bna hi nhi hain 
Jo log music sunte he aur bass jyada nhi chaiye 
Ye bast hain 
Bass lover ke liye reyalme t1000 Lelo osm bass hain 
Gaming ke liye ye bhi nhi hain 
Mere pas dono hi hain",0,2024-02-22T16:49:13Z,banda sahi bol rha hain be ye gaming ke liye bna hi nhi hain jo log music sunte he aur bass jyada nhi chaiye ye bast hain bass lover ke liye reyalme t1000 lelo osm bass hain gaming ke liye ye bhi nhi hain mere pas dono hi hain
Redmi Buds 4,YouTube,EqJgc1UVqh4,Which app should I use for using redmi 4 active buds,0,2024-01-20T17:38:19Z,which app should i use for using redmi 4 active buds
Redmi Buds 4,YouTube,EqJgc1UVqh4,Redmi 4 active boult w40 which one is better,1,2024-01-10T03:33:51Z,redmi 4 active boult w40 which one is better
Redmi Buds 4,YouTube,EqJgc1UVqh4,Voice calls Profamas,0,2024-01-02T16:46:28Z,voice calls profamas
Redmi Buds 4,YouTube,EqJgc1UVqh4,Bhai ye buds h mere pass bahut acchi h mera phone x I phone ye bahut jldi disconnect ho jati h kya krna chahiye wait for reply …..,0,2023-12-15T12:27:12Z,bhai ye buds h mere pass bahut acchi h mera phone x i phone ye bahut jldi disconnect ho jati h kya krna chahiye wait for reply
Redmi Buds 4,YouTube,EqJgc1UVqh4,I got free on buying note 12 4g for my dad❤,0,2023-12-13T16:10:18Z,i got free on buying note 12 4g for my dad
Redmi Buds 4,YouTube,EqJgc1UVqh4,Google assistant active nhi hota,0,2023-11-15T07:02:25Z,google assistant active nhi hota
Redmi Buds 4,YouTube,EqJgc1UVqh4,which one best sir Mi buds 4 active vs Noise Buds VS104 which one better?❤,9,2023-11-09T16:14:06Z,which one best sir mi buds 4 active vs noise buds vs104 which one better
Redmi Buds 4,YouTube,EqJgc1UVqh4,This one or boat or noise vs102 neo,0,2023-11-07T07:09:05Z,this one or boat or noise vs102 neo
Redmi Buds 4,YouTube,EqJgc1UVqh4,Buds charging time,0,2023-10-29T15:33:18Z,buds charging time
Redmi Buds 4,YouTube,EqJgc1UVqh4,Do they work good with iphone,6,2023-10-28T11:02:44Z,do they work good with iphone
Redmi Buds 4,YouTube,EqJgc1UVqh4,Mujhe cable diya hai c type,0,2023-10-23T05:43:53Z,mujhe cable diya hai c type
Redmi Buds 4,YouTube,EqJgc1UVqh4,Bass lover ke lia ye nahi hai ye only for Music lover and Melody in vocals like sony ❤❤❤,1,2023-10-22T08:00:26Z,bass lover ke lia ye nahi hai ye only for music lover and melody in vocals like sony
Redmi Buds 4,YouTube,EqJgc1UVqh4,Calling mein performance kesi hai like bhar open area mein Bhoht noise rehta hai usme kbhi kbhar voice break hone lgti hai generally,0,2023-10-21T11:57:18Z,calling mein performance kesi hai like bhar open area mein bhoht noise rehta hai usme kbhi kbhar voice break hone lgti hai generally
Redmi Buds 4,YouTube,EqJgc1UVqh4,"Wrost ear buds don't purchase it
It is very delicated ,I used only 8 days only",2,2023-10-19T09:50:23Z,wrost ear buds don t purchase it it is very delicated i used only 8 days only
Redmi Buds 4,YouTube,EqJgc1UVqh4,what about calls?,0,2023-10-15T04:14:05Z,what about calls
Redmi Buds 4,YouTube,EqJgc1UVqh4,How can I charge this item with my Android phone chargers as it does not provide charger?,2,2023-10-08T14:41:00Z,how can i charge this item with my android phone chargers as it does not provide charger
Redmi Buds 4,YouTube,EqJgc1UVqh4,Very good service sir 😍 amazing,2,2023-10-07T05:09:48Z,very good service sir amazing
Redmi Buds 4,YouTube,EqJgc1UVqh4,Mere pass he behtar he sab lekin calling me microvoice me dikat samne vale ko hoti he baki overall thik he,1,2023-09-26T20:16:27Z,mere pass he behtar he sab lekin calling me microvoice me dikat samne vale ko hoti he baki overall thik he
Redmi Buds 4,YouTube,EqJgc1UVqh4,Boat 141 vs redmi 4 active,1,2023-09-24T05:03:27Z,boat 141 vs redmi 4 active
Redmi Buds 4,YouTube,EqJgc1UVqh4,"Bhai apple is apple, thats when i closed the video😂.",1,2023-09-15T03:22:39Z,bhai apple is apple thats when i closed the video
Redmi Buds 4,YouTube,EqJgc1UVqh4,Is there a better earbud by boat or any other brand for a little more money?,12,2023-08-27T05:35:47Z,is there a better earbud by boat or any other brand for a little more money
Redmi Buds 4,YouTube,EqJgc1UVqh4,10mm driver hai brother,0,2023-08-07T17:18:10Z,10mm driver hai brother
Redmi Buds 4,YouTube,EqJgc1UVqh4,does this have double-click playback stop/play or single-click,1,2023-08-07T06:06:51Z,does this have double click playback stop play or single click
Redmi Buds 4,YouTube,EqJgc1UVqh4,Which is best redmi buds 4 or boat earpods max,16,2023-08-03T15:42:20Z,which is best redmi buds 4 or boat earpods max
Redmi Buds 4,YouTube,EqJgc1UVqh4,"Sir ye automatic redmi mobile se connect hogatey hey ya nahi ? 

Matlab popup window",0,2023-07-24T12:37:49Z,sir ye automatic redmi mobile se connect hogatey hey ya nahi matlab popup window
Redmi Buds 4,YouTube,EqJgc1UVqh4,@endoriexplorer In this earbuds Acc feature support?,0,2023-07-16T12:59:11Z,endoriexplorer in this earbuds acc feature support
Redmi Buds 4,YouTube,EqJgc1UVqh4,What should I buy This one or Noise Vs401?,2,2023-07-11T08:58:33Z,what should i buy this one or noise vs401
Redmi Buds 4,YouTube,EqJgc1UVqh4,don't buy this f****** tws....,0,2023-07-07T05:52:53Z,don t buy this f tws
Redmi Buds 4,YouTube,EqJgc1UVqh4,don't bye this product waste of money. haveing the pairing problume & sound problume,1,2023-07-06T13:21:21Z,don t bye this product waste of money haveing the pairing problume sound problume
Redmi Buds 4,YouTube,EqJgc1UVqh4,Is this better than boat 141 and noise aero??,1,2023-07-06T11:32:59Z,is this better than boat 141 and noise aero
Redmi Buds 4,YouTube,EqJgc1UVqh4,What about OnePlus Buds 2R?,3,2023-07-05T18:31:40Z,what about oneplus buds 2r
Redmi Buds 4,YouTube,EqJgc1UVqh4,"Bhai mere pass hai , Maine earbuds mi store se liya hoon , No Return policy hai, Itne Ghatiya quality ke Earbuds koi kaise bana skta hai bhai , it's Not Acceptable from Redmi , plz Guys Bilkul bhi mat Lena ....Bilkul bhi 🙏🙏🙏🙏🙏🙏🙏🙏🙏🙏",0,2023-07-03T09:25:25Z,bhai mere pass hai maine earbuds mi store se liya hoon no return policy hai itne ghatiya quality ke earbuds koi kaise bana skta hai bhai it s not acceptable from redmi plz guys bilkul bhi mat lena bilkul bhi
Redmi Buds 4,YouTube,EqJgc1UVqh4,Do a review for beats buds,1,2023-06-30T06:12:52Z,do a review for beats buds
Redmi Buds 4,YouTube,EqJgc1UVqh4,Is it better than oppo enco buds 2?,4,2023-06-29T04:21:13Z,is it better than oppo enco buds 2
Redmi Buds 4,YouTube,EqJgc1UVqh4,Bhai TRUKE NEO ki sound quality pe video banao na 🗿,0,2023-06-27T12:08:57Z,bhai truke neo ki sound quality pe video banao na
Redmi Buds 4,YouTube,EqJgc1UVqh4,Can we connect this on laptop/pc,2,2023-06-27T03:59:34Z,can we connect this on laptop pc
Redmi Buds 4,YouTube,EqJgc1UVqh4,Ram Ram ji bhaiya... Boat 170 vs ye..... Konsa achha rhega price ko agr hum include na kre to... Only features k mamle me konsa achha h?,3,2023-06-27T03:55:05Z,ram ram ji bhaiya boat 170 vs ye konsa achha rhega price ko agr hum include na kre to only features k mamle me konsa achha h
Redmi Buds 4,YouTube,EqJgc1UVqh4,Can you also review portronics Twin S6 or S7 earbuds please,8,2023-06-26T18:12:23Z,can you also review portronics twin s6 or s7 earbuds please
Redmi Buds 4,YouTube,EqJgc1UVqh4,Redmi buds 4 active Case changing time???,17,2023-06-26T17:03:30Z,redmi buds 4 active case changing time
Redmi Buds 4,YouTube,EqJgc1UVqh4,Itne bhi bdhia nhi h ye buds aaj hi delivery hui h mujhe bss emergency ke liye hi thik h  volume bhi kam h aur bass bhi bhot kam h inme🙄🙄,2,2023-06-26T14:38:41Z,itne bhi bdhia nhi h ye buds aaj hi delivery hui h mujhe bss emergency ke liye hi thik h volume bhi kam h aur bass bhi bhot kam h inme
Redmi Buds 4,YouTube,EqJgc1UVqh4,boat nirvana ion or oppo enco buds 2 which one to buy??,2,2023-06-26T08:32:58Z,boat nirvana ion or oppo enco buds 2 which one to buy
Redmi Buds 4,YouTube,EqJgc1UVqh4,Bhai wo light leak wala effect kha se download kru plz reply mil nhi rha ?,1,2023-06-26T06:07:45Z,bhai wo light leak wala effect kha se download kru plz reply mil nhi rha
Redmi Buds 4,YouTube,EqJgc1UVqh4,Sir Fire boltt Ring 3 1499 mai best h kya Ninja pro plus..... Please suggest me,1,2023-06-26T03:06:20Z,sir fire boltt ring 3 1499 mai best h kya ninja pro plus please suggest me
Redmi Buds 4,YouTube,EqJgc1UVqh4,Bhai mtlb music quality ap ko personally kase lage ess price pa ?,0,2023-06-25T20:11:47Z,bhai mtlb music quality ap ko personally kase lage ess price pa
Redmi Buds 4,YouTube,EqJgc1UVqh4,Sir Fire boltt Ring 3 1499 mai Best h ya koi or lu please reply,0,2023-06-25T19:42:20Z,sir fire boltt ring 3 1499 mai best h ya koi or lu please reply
Redmi Buds 4,YouTube,EqJgc1UVqh4,Waste product please don't buys voice is lagging too much,2,2023-06-25T17:39:39Z,waste product please don t buys voice is lagging too much
Redmi Buds 4,YouTube,EqJgc1UVqh4,Or we have to use it in pair,3,2023-06-25T16:47:52Z,or we have to use it in pair
Redmi Buds 4,YouTube,EqJgc1UVqh4,Can we use single right side bud,2,2023-06-25T16:47:34Z,can we use single right side bud
Redmi Buds 4,YouTube,EqJgc1UVqh4,Bro i buyed ptron playbuds 1 pro are they good,2,2023-06-25T15:42:34Z,bro i buyed ptron playbuds 1 pro are they good
Redmi Buds 4,YouTube,EqJgc1UVqh4,"I have a question 
Does it sound like oppo enco buds 2",0,2023-06-25T15:36:36Z,i have a question does it sound like oppo enco buds 2
Redmi Buds 4,YouTube,n-PhtLn4kR4,"You can watch the full review video of the Xiaomi Redmi Buds 4 Active: https://youtu.be/ceL1hIoWJbs

➨ Buy Xiaomi Redmi Buds 4 Active: https://ali.ski/pTzYg - Aliexpress",18,2023-07-06T10:41:52Z,you can watch the full review video of the xiaomi redmi buds 4 active buy xiaomi redmi buds 4 active aliexpress
Redmi Buds 4,YouTube,n-PhtLn4kR4,"Which do you recommend for gaming, the Buds 6 Play or the Buds 6 Lite?",0,2025-11-25T00:08:45Z,which do you recommend for gaming the buds 6 play or the buds 6 lite
Redmi Buds 4,YouTube,n-PhtLn4kR4,Bro one problem i use neckband and while using it and wifi even 5ghz it pings high what to do,0,2025-09-11T14:11:20Z,bro one problem i use neckband and while using it and wifi even 5ghz it pings high what to do
Redmi Buds 4,YouTube,n-PhtLn4kR4,Bro i need only charging case please help me😭🙏,3,2025-05-08T14:52:12Z,bro i need only charging case please help me
Redmi Buds 4,YouTube,n-PhtLn4kR4,How about redmi buds 6 active. There's no features like low latency just have rename on Xiaomi earbuds app. My device is Xiaomi 12. How I can turn on the low latency or gaming mode,0,2025-03-29T11:44:57Z,how about redmi buds 6 active there s no features like low latency just have rename on xiaomi earbuds app my device is xiaomi 12 how i can turn on the low latency or gaming mode
Redmi Buds 4,YouTube,n-PhtLn4kR4,1-10 how good they are,3,2025-01-13T17:15:59Z,1 10 how good they are
Redmi Buds 4,YouTube,n-PhtLn4kR4,I am there but it only says rename earbuds what do i do?,5,2024-12-27T22:44:30Z,i am there but it only says rename earbuds what do i do
Redmi Buds 4,YouTube,n-PhtLn4kR4,"Xiaomi buds 5 
No low latency mode??",9,2024-12-08T15:42:18Z,xiaomi buds 5 no low latency mode
Redmi Buds 4,YouTube,n-PhtLn4kR4,Problematic earbud . 2 earbud from redmi having suck issue … left hand side is not working after 7 month .. super suck brand,0,2024-11-19T16:06:18Z,problematic earbud 2 earbud from redmi having suck issue left hand side is not working after 7 month super suck brand
Redmi Buds 4,YouTube,n-PhtLn4kR4,How to low latency mode on sir ?,0,2024-08-30T11:35:15Z,how to low latency mode on sir
Redmi Buds 4,YouTube,n-PhtLn4kR4,"I want to ask something that, will there be any problem if I m using this earbuds for like 6-8 hr for lectures at full volume!?...",4,2024-08-03T15:48:26Z,i want to ask something that will there be any problem if i m using this earbuds for like 6 8 hr for lectures at full volume
Redmi Buds 4,YouTube,n-PhtLn4kR4,What is bass and latency!?,2,2024-08-03T15:37:46Z,what is bass and latency
Redmi Buds 4,YouTube,n-PhtLn4kR4,This or Edifier x3 lite??,10,2024-03-01T19:01:12Z,this or edifier x3 lite
Redmi Buds 4,YouTube,n-PhtLn4kR4,"Without the application, how do I know if I activated/inactivated the low latency mode after I hold both buds? Or it is automatically turned off after I disconnected the buds and put it in the pod?",10,2024-03-01T05:36:38Z,without the application how do i know if i activated inactivated the low latency mode after i hold both buds or it is automatically turned off after i disconnected the buds and put it in the pod
Redmi Buds 4,YouTube,n-PhtLn4kR4,"which one for gaming, redmi buds 4 lite or active?",1,2024-02-20T11:36:03Z,which one for gaming redmi buds 4 lite or active
Redmi Buds 4,YouTube,n-PhtLn4kR4,Do i need to download the app to enable this?,6,2024-02-19T07:57:53Z,do i need to download the app to enable this
Redmi Buds 4,YouTube,n-PhtLn4kR4,Is it available on poco phones?,0,2024-02-07T04:42:47Z,is it available on poco phones
Redmi Buds 4,YouTube,n-PhtLn4kR4,Game name please? ⬇️,2,2023-12-22T14:24:06Z,game name please
Redmi Buds 4,YouTube,8rfNVQadQgQ,I own this but everytime i play pugb mobile my friends cant hear me 😢,0,2025-11-04T02:51:49Z,i own this but everytime i play pugb mobile my friends cant hear me
Redmi Buds 4,YouTube,8rfNVQadQgQ,"App for airbud 2 not suport.
What app suport for xiaomi airbud 2",0,2025-08-28T14:19:14Z,app for airbud 2 not suport what app suport for xiaomi airbud 2
Redmi Buds 4,YouTube,8rfNVQadQgQ,How to pair Xiaomi watch with Eber 6 earphones ?,0,2025-06-05T11:51:40Z,how to pair xiaomi watch with eber 6 earphones
Redmi Buds 4,YouTube,8rfNVQadQgQ,Why is the custom for equalizer not showing out.,0,2025-05-11T03:03:54Z,why is the custom for equalizer not showing out
Redmi Buds 4,YouTube,8rfNVQadQgQ,I lost one side of earbuds tell me what can i do,1,2025-03-28T14:36:48Z,i lost one side of earbuds tell me what can i do
Redmi Buds 4,YouTube,8rfNVQadQgQ,Listen the music left size is not hear is why???,0,2024-07-27T14:06:06Z,listen the music left size is not hear is why
Redmi Buds 4,YouTube,8rfNVQadQgQ,What apps do you used,0,2024-07-25T10:13:43Z,what apps do you used
Redmi Buds 4,YouTube,8rfNVQadQgQ,so the app is basically useless..havent see earbuds with app that cant change the settings of the button or the option to cancel noise etc etc through the application,10,2024-07-08T17:27:03Z,so the app is basically useless havent see earbuds with app that cant change the settings of the button or the option to cancel noise etc etc through the application
Redmi Buds 4,YouTube,8rfNVQadQgQ,Which app we use,0,2024-06-23T05:49:53Z,which app we use
Redmi Buds 4,YouTube,8rfNVQadQgQ,Why isn't mine there? low latency How to make it go up?low latency,0,2024-05-04T14:39:22Z,why isn t mine there low latency how to make it go up low latency
Redmi Buds 4,YouTube,8rfNVQadQgQ,"Does this work for the Redmi Bud 3 Pro, too?",0,2024-04-21T13:24:20Z,does this work for the redmi bud 3 pro too
Redmi Buds 4,YouTube,8rfNVQadQgQ,I owned a buds 4 active but in the app it doesnt show the case battery status. what should I do?,2,2024-03-26T08:10:29Z,i owned a buds 4 active but in the app it doesnt show the case battery status what should i do
Redmi Buds 4,YouTube,8rfNVQadQgQ,I can't connect my bus 4 active it shows it on my Bluetooth settings but not on the xiaomi app,0,2024-03-08T08:01:47Z,i can t connect my bus 4 active it shows it on my bluetooth settings but not on the xiaomi app
Redmi Buds 4,YouTube,8rfNVQadQgQ,I owned a Xiaomi Buds Pro 3 for more than 2 years now and I have only known this dedicated app for Xiaomi earphones exists just now because of this video 😅,8,2024-02-26T18:35:45Z,i owned a xiaomi buds pro 3 for more than 2 years now and i have only known this dedicated app for xiaomi earphones exists just now because of this video
Redmi Buds 4,YouTube,8rfNVQadQgQ,I'm from Pakistan and I'm having Redmi Buds 4 but it is not connecting to Xiaomi earbuds application please tell me the solution,3,2024-02-25T05:31:34Z,i m from pakistan and i m having redmi buds 4 but it is not connecting to xiaomi earbuds application please tell me the solution
Redmi Buds 4,YouTube,8rfNVQadQgQ,Bro the case is not showing for me any tips?,0,2024-02-13T12:33:42Z,bro the case is not showing for me any tips
Redmi Buds 4,YouTube,8rfNVQadQgQ,What about the Redmi Buds 4 Lite,7,2024-01-27T10:48:38Z,what about the redmi buds 4 lite
Redmi Buds 4,YouTube,8rfNVQadQgQ,How to connect redmi earbuds 4 active to that application?,0,2024-01-25T10:49:04Z,how to connect redmi earbuds 4 active to that application
Redmi Buds 4,YouTube,8rfNVQadQgQ,Hi. Can you please tell me ' xiaomi air 3 se' can be connected through this app? I am struggling,0,2024-01-25T04:03:26Z,hi can you please tell me xiaomi air 3 se can be connected through this app i am struggling
Redmi Buds 4,YouTube,8rfNVQadQgQ,it doesn't work on mi true wireless earbuds 2s,0,2024-01-20T15:28:43Z,it doesn t work on mi true wireless earbuds 2s
Redmi Buds 4,YouTube,8rfNVQadQgQ,"It won't let me pair my redmi buds 5 in the app, I have a pixel 8 pro. any solution please?",0,2024-01-13T21:38:09Z,it won t let me pair my redmi buds 5 in the app i have a pixel 8 pro any solution please
Redmi Buds 4,YouTube,8rfNVQadQgQ,There is no redmi buds 4 lite,0,2024-01-07T08:19:05Z,there is no redmi buds 4 lite
Redmi Buds 4,YouTube,8rfNVQadQgQ,redmi buds 4 active had ANC and transparanted mode?,0,2024-01-06T17:15:54Z,redmi buds 4 active had anc and transparanted mode
Redmi Buds 4,YouTube,8rfNVQadQgQ,Do Redmi buds 3 lite have noise cancelling? Can this be turned on n off in the app?,1,2024-01-03T12:54:10Z,do redmi buds 3 lite have noise cancelling can this be turned on n off in the app
Redmi Buds 4,YouTube,8rfNVQadQgQ,What is app called?,0,2023-12-31T18:04:11Z,what is app called
Redmi Buds 4,YouTube,8rfNVQadQgQ,Bro Foes jt work with non redmi ohone liks Oneplus,1,2023-12-25T16:58:09Z,bro foes jt work with non redmi ohone liks oneplus
Redmi Buds 4,YouTube,8rfNVQadQgQ,Is it possible to connect redmi buds 4 lite there? I didn't figure it out somehow.,2,2023-12-22T08:52:34Z,is it possible to connect redmi buds 4 lite there i didn t figure it out somehow
Redmi Buds 4,YouTube,8rfNVQadQgQ,"Never buy redmi buds 4 active. You'll regret.
Go for soundpeats earbuds with ANC and much better  sound quality. Redmi buds 4 active sound feels like that of cheap earbuds",2,2023-12-07T19:25:15Z,never buy redmi buds 4 active you ll regret go for soundpeats earbuds with anc and much better sound quality redmi buds 4 active sound feels like that of cheap earbuds
Redmi Buds 4,YouTube,8rfNVQadQgQ,Can someone tell me why ONLY my right headphone os conecting??,0,2023-12-02T18:28:31Z,can someone tell me why only my right headphone os conecting
Redmi Buds 4,YouTube,8rfNVQadQgQ,Has anyone the same Problem as me if i change musik my musik is fcked up and i need to pull my right earpod out an put in in to get it work has somone an explanation fir it ?,0,2023-11-24T15:50:35Z,has anyone the same problem as me if i change musik my musik is fcked up and i need to pull my right earpod out an put in in to get it work has somone an explanation fir it
Redmi Buds 4,YouTube,8rfNVQadQgQ,Can i charge it whit 15 wat charger?,2,2023-11-16T05:19:50Z,can i charge it whit 15 wat charger
Redmi Buds 4,YouTube,8rfNVQadQgQ,can i charge xiaomi buds 4 global version with 67 watts type c charger?,0,2023-10-24T09:17:06Z,can i charge xiaomi buds 4 global version with 67 watts type c charger
Redmi Buds 4,YouTube,8rfNVQadQgQ,My buds right side always chargeing while remove from the case i count not connect to the right side any solution for this 😢😢😢,0,2023-10-15T05:26:58Z,my buds right side always chargeing while remove from the case i count not connect to the right side any solution for this
Redmi Buds 4,YouTube,8rfNVQadQgQ,Is there redmi 3 lite in the app ?,0,2023-10-14T20:06:59Z,is there redmi 3 lite in the app
Redmi Buds 4,YouTube,8rfNVQadQgQ,Noise vs102 airbuds not connecting to the app which app to use,0,2023-10-13T11:11:41Z,noise vs102 airbuds not connecting to the app which app to use
Redmi Buds 4,YouTube,8rfNVQadQgQ,"I have a question please.
My Airpods are: Redmi Buds 4 Active.
The problem is that the right pod wouldn't charge or connect. What should i do?",3,2023-10-06T18:01:53Z,i have a question please my airpods are redmi buds 4 active the problem is that the right pod wouldn t charge or connect what should i do
