source,date,title,link,keyword_tag
Born2Invest,1 day ago,Cheap redmi earbuds connect Online Amazon Xiaomi Redmi Buds 4 Active TWS Wireless Earbuds,https://born2invest.com/%3Fb%3Dstyle-328647812&ved=2ahUKEwi7_8fsqYaSAxWhzjgGHUOIAL8QxfQBegQIAhAC&usg=AOvVaw0MuM4TgZZT-Gr-1N_8ahfD,Redmi Buds 8 Lite review
Born2Invest,2 days ago,Sale best earphones xiaomi Best Sale Best Xiaomi Headphones ThePhonograph,https://born2invest.com/%3Fb%3Dstyle-305972612&ved=2ahUKEwi7_8fsqYaSAxWhzjgGHUOIAL8QxfQBegQIBBAC&usg=AOvVaw3eUQXa1v2p7w7xIlhT2-8C,Redmi Buds 8 Lite review
Born2Invest,3 days ago,Cheap realme buds air vs xiaomi airdots Online realme Buds Air 5 Pro Truly Wireless in Ear Earbuds with 50dB ANC,http://born2invest.com/%3Fb%3Dstyle-339839312&ved=2ahUKEwi7_8fsqYaSAxWhzjgGHUOIAL8QxfQBegQIChAC&usg=AOvVaw2ytHwjB1iYPN2a7uIY6aF1,Redmi Buds 8 Lite review
Born2Invest,3 days ago,Top mi buds basic Outlet Online Xiaomi Redmi Buds 4 Lite Black BHR7118GL,http://born2invest.com/%3Fb%3Dstyle-300541512&ved=2ahUKEwi7_8fsqYaSAxWhzjgGHUOIAL8QxfQBegQICBAC&usg=AOvVaw04-2RvVrNfjmUjmfPJYxDj,Redmi Buds 8 Lite review
TechPP,1 week ago,Redmi 15C Review: Setting a new budget benchmark?,https://techpp.com/2026/01/04/redmi-15c-review/&ved=2ahUKEwi7_8fsqYaSAxWhzjgGHUOIAL8QxfQBegQIAxAC&usg=AOvVaw2lxshottODyLwAwxuNf3pn,Redmi Buds 8 Lite review
YugaTech,2 months ago,Xiaomi debuts the Redmi Watch 6,https://www.yugatech.com/news/xiaomi-debuts-the-redmi-watch-6/&ved=2ahUKEwi7_8fsqYaSAxWhzjgGHUOIAL8QxfQBegQIBxAC&usg=AOvVaw3D2EBr6jRkxgZ4upPs4nOJ,Redmi Buds 8 Lite review
RTINGS.com,2 months ago,The 6 Best True Wireless Earbuds of 2026,https://www.rtings.com/headphones/reviews/best/by-type/truly-wireless-earbuds&ved=2ahUKEwi7_8fsqYaSAxWhzjgGHUOIAL8QxfQBegQIARAC&usg=AOvVaw0xyLVNEIpdd0kQJsHSyJwI,Redmi Buds 8 Lite review
TechPP,2 months ago,OnePlus Pad Lite Review: Viewing delight on a budget - TechPP,https://techpp.com/2025/10/14/oneplus-pad-lite-review/&ved=2ahUKEwi7_8fsqYaSAxWhzjgGHUOIAL8QxfQBegQIBhAC&usg=AOvVaw1KWOj1nFWRJjER1cm4P4MG,Redmi Buds 8 Lite review
Android Central,3 months ago,"I put the Pixel Buds 2a through their paces, here's how it went",https://www.androidcentral.com/accessories/earbuds/google-pixel-buds-2a-review&ved=2ahUKEwi7_8fsqYaSAxWhzjgGHUOIAL8QxfQBegQIBRAC&usg=AOvVaw261KnzEDghTU4_sg8YZBAp,Redmi Buds 8 Lite review
Scarbir,3 months ago,Samsung Galaxy Buds Core review: Better than the Buds FE?,https://www.scarbir.com/tws/samsung-galaxy-buds-core-review&ved=2ahUKEwi7_8fsqYaSAxWhzjgGHUOIAL8QxfQBegQICRAC&usg=AOvVaw1m5OEkoaMTQCm1lGe27YWy,Redmi Buds 8 Lite review
Born2Invest,1 day ago,Top redmi earbuds s charger New Arrivals Redmi Earbuds Charging Problem How To Fix YouTube,http://born2invest.com/%3Fb%3Dstyle-324785712&ved=2ahUKEwjlkIXuqYaSAxXY9jgGHSRiDfkQxfQBegQIAhAC&usg=AOvVaw13PR9-tCpXkM9CFQP-_fZE,Redmi Buds 6 Pro problems
Huawei Central,3 days ago,New HyperOS update fixed camera issues for these Xiaomi devices,https://www.huaweicentral.com/new-hyperos-update-fixed-camera-issues-for-these-xiaomi-devices/&ved=2ahUKEwjlkIXuqYaSAxXY9jgGHSRiDfkQxfQBegQIAxAC&usg=AOvVaw0kPIEMbhgOx_fkNgTKzKTV,Redmi Buds 6 Pro problems
Scarbir,6 days ago,The Best Cheap Wireless Earbuds under $25 - January 2026,https://www.scarbir.com/guide/wireless-earphones-under-25-dollar&ved=2ahUKEwjlkIXuqYaSAxXY9jgGHSRiDfkQxfQBegQIChAC&usg=AOvVaw0S3tc76jK0xsNjl3UDKyva,Redmi Buds 6 Pro problems
XiaomiTime,1 week ago,January 2026 Bluetooth update rolling out to all Xiaomi devices,https://xiaomitime.com/new-bluetooth-update-rolling-out-to-all-xiaomi-devices-49174/&ved=2ahUKEwjlkIXuqYaSAxXY9jgGHSRiDfkQxfQBegQIBxAC&usg=AOvVaw1ovx6nGw8PRuNtBamFzyGE,Redmi Buds 6 Pro problems
Geekman,1 month ago,Best Earbuds Under 5000 in India (2025),https://www.geekman.in/best-tws-earbuds-under-5000-india/&ved=2ahUKEwjlkIXuqYaSAxXY9jgGHSRiDfkQxfQBegQIBhAC&usg=AOvVaw1JEwMJgYcv-oR1x5rrL8Y1,Redmi Buds 6 Pro problems
Beebom,2 months ago,"How to Fix Xiaomi Phone Stuck on Redmi, Mi, Fastboot, MIUI Logo",https://beebom.com/how-fix-xiaomi-phone-stuck-redmi-mi-fastboot-miui-logo/&ved=2ahUKEwjlkIXuqYaSAxXY9jgGHSRiDfkQxfQBegQIBRAC&usg=AOvVaw2dUcYTxwvlANsslpm0XgPU,Redmi Buds 6 Pro problems
Scarbir,3 months ago,Review: Apple AirPods Pro 3 vs budget wireless earphones,https://www.scarbir.com/tws/apple-airpods-pro-3-review&ved=2ahUKEwjlkIXuqYaSAxXY9jgGHSRiDfkQxfQBegQIARAC&usg=AOvVaw2wL72KmQBzyDNpkJKRM6Mq,Redmi Buds 6 Pro problems
Gizmodo,3 months ago,This Wireless Tech Could Fix the Most Annoying Thing About Using Wireless Earbuds at Home,https://gizmodo.com/this-wireless-tech-could-fix-the-most-annoying-thing-about-using-wireless-earbuds-at-home-2000664306&ved=2ahUKEwjlkIXuqYaSAxXY9jgGHSRiDfkQxfQBegQIBBAC&usg=AOvVaw3YrC3NkISl9oqLFgQbFYyi,Redmi Buds 6 Pro problems
TechRadar,3 months ago,Xiaomi's shiny new open earbuds fix one massive problem with this kind of headphone design,https://www.techradar.com/audio/earbuds-airpods/xiaomis-shiny-new-open-earbuds-fix-one-massive-problem-with-this-kind-of-headphone-design&ved=2ahUKEwjlkIXuqYaSAxXY9jgGHSRiDfkQxfQBegQICBAC&usg=AOvVaw0MZuOomZWxwIPBRz_NnPVj,Redmi Buds 6 Pro problems
Scarbir,3 months ago,"Samsung Galaxy Buds3 FE review: One love, three dislikes",https://www.scarbir.com/tws/samsung-galaxy-buds3-fe-review&ved=2ahUKEwjlkIXuqYaSAxXY9jgGHSRiDfkQxfQBegQICRAC&usg=AOvVaw20V5HVOwJQ0Wdp4OqoX6nA,Redmi Buds 6 Pro problems
Born2Invest,9 hours ago,Discount redmi wireless headphones price Cheap Sale Blue And Black Redmi Sonicbass Wireless Earphone Mobile Model,http://born2invest.com/%3Fb%3Dstyle-300176712&ved=2ahUKEwiV5L_uqYaSAxVnxDgGHf-0J_4QxfQBegQIAhAC&usg=AOvVaw3fcv8GGi7GUSZ2L-q9oKQx,Redmi SonicBass Wireless 2 review
Born2Invest,1 hours ago,Shop mi earphones list Clearance Xiaomi Hybrid Earphones Review The Headphone List,https://born2invest.com/%3Fb%3Dstyle-305089612&ved=2ahUKEwiV5L_uqYaSAxVnxDgGHf-0J_4QxfQBegQIARAC&usg=AOvVaw0pugTprQR1eRPNoC8HAzMl,Redmi SonicBass Wireless 2 review
Born2Invest,1 day ago,Sale mi true wireless earphones india Best Sale Mi True Wireless Earphones 2C With 14.2mm Drivers Environmental,https://born2invest.com/%3Fb%3Dstyle-340854812&ved=2ahUKEwiV5L_uqYaSAxVnxDgGHf-0J_4QxfQBegQIChAC&usg=AOvVaw0-KpfUagrxZmGz0uTFR_WU,Redmi SonicBass Wireless 2 review
Born2Invest,1 day ago,Shop redmi sonicbass wireless earphones price on Sale Redmi SonicBass Wireless Earphones Review Gadgets 360,https://born2invest.com/%3Fb%3Dstyle-303119512&ved=2ahUKEwiV5L_uqYaSAxVnxDgGHf-0J_4QxfQBegQIBBAC&usg=AOvVaw3KgJFmlp7b12VMq4hlTK-u,Redmi SonicBass Wireless 2 review
Born2Invest,1 day ago,Discount sonic bass earphones Cheap Sale Redmi SonicBass Wireless Earphones Review,http://born2invest.com/%3Fb%3Dstyle-315740412&ved=2ahUKEwiV5L_uqYaSAxVnxDgGHf-0J_4QxfQBegQIBxAC&usg=AOvVaw1SDr7RP4GwgP8Ci_wa2Tf0,Redmi SonicBass Wireless 2 review
Born2Invest,2 days ago,Best mi store wireless earphones Top Sellers Xiaomi Mi True Wireless Earbuds Basic 2 Global Bluetooth 5.0 12,https://born2invest.com/%3Fb%3Dstyle-317703512&ved=2ahUKEwiV5L_uqYaSAxVnxDgGHf-0J_4QxfQBegQICRAC&usg=AOvVaw2PSh8KuEwK-L4h8dSS_3FN,Redmi SonicBass Wireless 2 review
Born2Invest,2 days ago,Shop xiaomi wireless earphones review Clearance Noise IntelliBuds True Wireless Earphones Review Smarter,https://born2invest.com/%3Fb%3Dstyle-319382512&ved=2ahUKEwiV5L_uqYaSAxVnxDgGHf-0J_4QxfQBegQICBAC&usg=AOvVaw0vFfcpvQ6snb15ozdCUvwg,Redmi SonicBass Wireless 2 review
Born2Invest,3 days ago,Shop redmi sonic bass neckband bluetooth headset review Outlet Online Redmi SonicBass Neckband Bluetooth Headset Blue In the Ear,http://born2invest.com/%3Fb%3Dstyle-324788812&ved=2ahUKEwiV5L_uqYaSAxVnxDgGHf-0J_4QxfQBegQIBRAC&usg=AOvVaw1DRQRHAbk7gn9GdNmNuwYU,Redmi SonicBass Wireless 2 review
Born2Invest,4 days ago,Hot mi sonicbass wireless earphones Sale RedMI SonicBass Wireless Earphones Black in Latur at best price,https://born2invest.com/%3Fb%3Dstyle-312053512&ved=2ahUKEwiV5L_uqYaSAxVnxDgGHf-0J_4QxfQBegQIBhAC&usg=AOvVaw01BOAVqqKAI6TUX4sYC7Hi,Redmi SonicBass Wireless 2 review
News9live,9 months ago,Redmi 12 Review: Versatile camera kit and premium design at 10k price point,https://www.news9live.com/technology/review/redmi-12-review-versatile-camera-kit-and-premium-design-at-10k-price-point-2232781&ved=2ahUKEwiV5L_uqYaSAxVnxDgGHf-0J_4QxfQBegQIAxAC&usg=AOvVaw2UyzXyvA0tD4R2ZHT7kHzN,Redmi SonicBass Wireless 2 review
